appId,free,score,screenshots,descriptionHTML,developer,icon,genre,videoImage,video,price,currency,installs,title
com.codeway.chatapp,True,4.486692,"https://play-lh.googleusercontent.com/W5UpdPb3LTPDFn3sikSEFuMmwvcaOy8WDKSS8JIgkqSqNWcK2Qe-6CJP6IwXbi9nZBM, https://play-lh.googleusercontent.com/mzWlZHbolAEk2THv2lffTyfYCrzPYvvSFpywbSTUGM7X6XUDPWyQxUltO4ZGE654Mw, https://play-lh.googleusercontent.com/B9l2mjKgQxO2lhxIQBHgapcA3L2vvPXUCVZip7FefLx-kHuUVHxljlrcaWzp7vGH8s45, https://play-lh.googleusercontent.com/7ULTrarL8YDE4nifiWlAKWLSloqPp4v_zrysw2cY_QnGLe5B33IFjbcqqDTVJK-lWfM, https://play-lh.googleusercontent.com/IBFA3UsPQGRORJyR1It0OORNTsLd_143sMrOdqD9neEy87XLfqGdRn9c2aC4SnLfwKk, https://play-lh.googleusercontent.com/_BtvpoXzRjVmHRpu1QFSq1wdMfLKziKCB3fKVjv-zc31CVQayDoBKndTCa_AtQCUwQ, https://play-lh.googleusercontent.com/ROsSIbbkFUeBtDnaICz2Da2x3XRgL5iZOyXSCxdnu9JSbzbG6pEb-mQhuMOz9WN0b_Vd, https://play-lh.googleusercontent.com/iUlEeh1HtIezpjPHRm0AuX1kaSizFIytgKMLnPlDdqT3C0xOR245yJKTd7GIRbZFaPc, https://play-lh.googleusercontent.com/JoTSTzJ5loPFlKuLe6AnzoUVbpf343i2_D2lcEo2-TDOOjAikOj3eKN4popT0V8rgg","Welcome to Ask AI – Discover Endless Possibilities Every Day!<br><br>Experience conversations with an AI that understands you, adapts to your mood, and personalizes interactions, making each engagement unique.<br><br>ASK ANYTHING, ANYTIME:<br>Ignite your curiosity and engage in fascinating conversations with historical figures, business gurus, or even your favorite celebrities. Built on the GPT-4o model, Ask AI is always ready to offer recommendations, inspiration, and information on any topic.<br><br>IMAGE GENERATION AND EXPLORATION:<br><br>- Be Your Own Artist: Use our AI generator to create images from text, visualizing everything from fantastic scenes to futuristic cities. Our AI turns your descriptions into stunning visuals – perfect for creating book covers, social media posts, and more.<br>- Discover Your World Through Images: Snap a photo of anything around you (buildings, art, landscapes) and instantly gain insights with our image input technology. Use the text-to-image feature to convert visual information into readable text.<br><br>ENHANCED TEXT GENERATOR FOR EASY WRITING ASSISTANCE:<br>Our AI-powered writing assistant helps you generate ideas, craft detailed outlines, and effortlessly compose complete articles or creative works. From professional emails to creative stories and songs, managing writing tasks has never been easier.<br><br>FUN LANGUAGE LEARNING AND HOMEWORK HELPER:<br><br>- Language Practice: Immerse yourself in new languages through interactive scenarios, like a samurai adventure in Japanese or managing a restaurant in Spanish. Ask AI, built on GPT-4o, makes learning fun and practical.<br>- Academic Support: Whether it&#39;s a tough math problem or a complex science project, use Ask AI as your reliable homework helper.<br><br>SMART SUMMARY ASSISTANT:<br><br>- Quick Summaries: Get the essence of long videos or detailed documents in an interactive and engaging format. <br>- Ask Questions: Upload documents or add links to articles or videos, ask your questions, and receive instant accurate answers with the help of Ask AI.<br><br>EASY WEB SEARCH:<br>Need the latest information on technological innovations, fashion trends, or health tips? Ask AI Chatbot, scours the web to bring you the most relevant and up-to-date information, keeping you always in the know.<br><br>PERSONALIZED RECOMMENDATIONS AND CREATIVE INSPIRATION:<br>Whether you&#39;re searching for new books, planning your next trip, or seeking creative inspiration, Ask AI offers personalized suggestions and ideas based on your preferences and interests.<br><br>EXPERIENCE THE MOST HUMAN INTERACTIONS:<br>The friendly, conversational tone of Ask AI, and its ability to adapt to your mood, makes every interaction feel like you&#39;re chatting with a friend. It’s not just a chatbot; it’s a new form of AI companionship that enriches your daily life.<br><br>Join us on this exciting journey. Download Ask AI now and start exploring a world full of possibilities with the power of AI Chatbot.<br><br>Privacy Policy: https://static.askaichat.app/privacy-en.html<br>Terms of Use: https://static.askaichat.app/terms-conditions-en.html",Codeway Dijital,https://play-lh.googleusercontent.com/lI3MeWGtckeFE_PbVxe_cP8rjKpKXcraFt3HQmBifmbJS-bKCWd4WnlYPeNxhVhkAwg,Productivity,,,0,USD,"10,000,000+",Ask AI - Chat with AI Chatbot
com.Beauchamp.Messenger.external,True,4.2886114,"https://play-lh.googleusercontent.com/HhZGsCQEeHU3mUq062m68KZjTj2FS7qY2Q2IdC2JNBg2-iUCNByryEsQdXVxhcPB3rkP, https://play-lh.googleusercontent.com/a5xUo1B47mk8njIYsHTKkB2OP0Y_GJREee9YpDp5S664v1xF7Z0nEXP6iZg7GMz3xA, https://play-lh.googleusercontent.com/JN8OlY7bZDMWCMtLPlGM7Pibfa3NxihS1OdpnkzPt0OFpCyIo2U2lQz_AwLyrNOJAQ, https://play-lh.googleusercontent.com/2KoPKLeUbxxxbjTkPCzGLljHdeV0yIQOBQt4PH1j6HqrwnrJ9gvVniTHfOBKr0i7WdpH, https://play-lh.googleusercontent.com/FRAPdDor4Xz6wIr915nBVgkxa18yGsSLYn-SfubdaCdwbUTorDBLSDej78UO3g0q9UY, https://play-lh.googleusercontent.com/eeRsmyx7t8AiO3-GLScPL65kpwTiSXyUt1PwKRzK9veGjNS3x8IQXIA-KYeVcGF8Yyc, https://play-lh.googleusercontent.com/x578XhhtSLFsepunl8lW_hHZtEXi_W0yOm9sLgAkOzi53l6lDOrxQM5WajYHlR7vww4","Our app revolutionizes the way we interact with AI chatbots. With our advanced technology, our chatbots think and reply like real characters, complete with authentic voices. You can choose from a massive selection of characters, each with their own unique voice and personality. Whether you&#39;re chatting with your favorite celebrity, a beloved character from a movie or TV show, or a historical figure, you&#39;ll feel like you&#39;re talking to a real person.<br><br><br>Character creation - Character creation now open to everyone! Ignite your imagination and bring any character to life here, whether they exist in reality or flourish in the realm of imagination! Unleash your creativity and craft a character that can be kept entirely private or shared for everyone to engage with. But the excitement doesn&#39;t end there - immerse yourself in a vibrant community where you can also interact with characters crafted by others! Join the adventure and let your characters come alive in this thrilling experience!<br><br>Image generation - Unleash your inner artist with our newly introduced image generation feature, where the power of AI meets boundless creativity. Simply provide a prompt, and watch as our advanced technology brings your vision to life—be it breathtaking landscapes, enchanting fantasy realms, or hyper-realistic portraits. With limitless possibilities and no restrictions on how many images you can create, you can experiment freely until you achieve the perfect masterpiece. Whether you’re a seasoned artist or simply looking to explore your creative side, our image generation tool is here to spark your imagination and transform your ideas into stunning visual art.<br><br><br>Unlimited free messages - With no limitations on the length or frequency of chats, users can engage in endless conversations without any restrictions. This means that you can chat with your favorite characters or npc unlimitedly, completely free of charge and without ever having to worry about running out of time or exceeding any limits.<br><br><br>Immerse yourself in endless conversations - Unlike traditional chatbots, which can quickly become repetitive and boring, our AI chatbots use cutting-edge technology to generate responses that feel natural and engaging. All you need to do is to enjoy the free talk.<br><br><br>Never run out of new things to explore - Our app is perfect for anyone who loves to chat, learn, and explore. Whether you&#39;re a history buff, a fan of pop culture, or just looking for a fun way to pass the time, our AI chatbots will provide you with endless entertainment and engagement. And with our constantly growing selection of characters, you&#39;ll never run out of new personalities to chat with.<br><br><br>Our app provides users with the ultimate immersive conversational experience. With authentic voices and character thinking, our chatbots will make you feel like you&#39;re talking to a real person. You&#39;ll never run out of things to say, and there are no language barriers to hold you back. So why not download our app today and start exploring the world of endless conversations all for free?",Chai Research Corp.,https://play-lh.googleusercontent.com/4MERnA5CP1fHDL16ZJ_vr-qchaDbgYGQUUZcTqtfBAsyxm-Y0Y8oxUUCWF0cmotZyBLE,Entertainment,,,0,USD,"10,000,000+",Chai: Chat AI Platform
com.aidungeon,True,4.0168295,"https://play-lh.googleusercontent.com/LIWwu8UX9H5Ed_W3qIih8aGTg24fpTDL5tMbGnxWeD4TBeVCVr7pyy4fOb9h4_Agi4Tb, https://play-lh.googleusercontent.com/i83dxmhEIJT0vLWk7CaPlU8iV2qJIxnzd4r2LoPZWtaKhPn9eOfQP1C477GlCYKrYm0, https://play-lh.googleusercontent.com/tO-xbkN2MNngh8Hnige8rWOZmHuKmSKSOcytx70r9LEvMzPda3uvAazWaWfwufXmUQ, https://play-lh.googleusercontent.com/K7tPBs0j2S0Y2vrFLJRw_F0v_RmEIqJV4En5oB45Mhp1ab_SMhmZID0VAJu4UUgzgw, https://play-lh.googleusercontent.com/_1bxqs-E_EzbnWwdSo35mLXPbO3qKjf76qyqLf1zUzWcb8g8aIL_CWHAJzRbB2yhX1Y, https://play-lh.googleusercontent.com/FKJEYpnhxbS5a3qUOaq1j_PnckqTPJ-hToz9h9P2v5ON-zmSfTlsSCy2AoAd0lDkXg, https://play-lh.googleusercontent.com/hPtnamx-u_AGUcD0raKMU-KrG66FUkjzR1wCf2EgEsKVYByIuFnnVsqzAl5Ps26ftKE","AI Dungeon is the top AI-powered roleplay game. Experience infinite adventures and explore endless scenarios from any genre.<br><br>Download the app to play for free without ads! Create an account to access your stories on any device. <br><br>In AI Dungeon, you can:<br><br>- Play text adventures with custom or preset prompts<br>- Collaborate with artificial intelligence<br>- Try different AI models, including ChatGPT<br>- Create unique AI images during gameplay<br>- Build detailed worlds with customizable setups<br>- Invite friends to join your multiplayer games<br>- Share your content with our community of players<br>- Discover other user-generated scenarios and adventures<br><br>Be the main character (and director) of your AI-driven stories. Download AI Dungeon today!",Latitude Inc.,https://play-lh.googleusercontent.com/ALmVcUVvR8X3q-hOUbcR7S__iicLgIWDwM9K_9PJy87JnK1XfHSi_tp1sUlJJBVsiSc,Adventure,https://i.ytimg.com/vi/TNL4BzcvGdY/hqdefault.jpg,https://www.youtube.com/embed/TNL4BzcvGdY?ps=play&vq=large&rel=0&autohide=1&showinfo=0,0,USD,"1,000,000+",AI Dungeon
ai.replika.app,True,4.1787906,"https://play-lh.googleusercontent.com/Udl2z03yYFRrQ1uyWlr2HGVUGvk4RCnuAxhjcBJUSoNxw6tigVA0hDx0FtQq9EsOt4U, https://play-lh.googleusercontent.com/ahazGSB0X-IURIp_EYIdbIfcl2IZEFCKyfpbUKX0W4sct07I_LtPXHOtxXp_U2ApeaQ, https://play-lh.googleusercontent.com/92BSXy3CJwZAvIFFWsISuhleE-zKBJxPjblFbN0malkYTJ6jgCtwu1CHGyItoPjStKc, https://play-lh.googleusercontent.com/NoBNpRDHopi0ywtUg2VpffZ7h8wpmnozxJRN886RRgOs-O0KulTBLSXYjROvWL8fsW8, https://play-lh.googleusercontent.com/jasRBB9K-K80sFJMd1SSZgr4Hr1vE4mds-8MApEeepZuFb0i1p5qLFtAMiOzpki5A1g, https://play-lh.googleusercontent.com/nbMp4u-IWCCZwVNKWElXKoXdIjTskFUfcMjNT7C0Lu9b-8zFvSRSoM459lYAvSAwS2k, https://play-lh.googleusercontent.com/tMRf3uU4QM0uM-1yezplueP77q7iYPppU9jiCCL7WIyRlA7BdROEKJRCO8n4DPBKmw, https://play-lh.googleusercontent.com/QeROnrAGhNYTHAXkboYUYnywr_0khn1l71Tqfnb7UVGu8e5hmmjtYtWVOUzi_z9AbEA","Replika is a #1 chatbot companion powered by artificial intelligence. Join millions talking to their own AI friends!<br><br>Replika is for anyone who wants a friend with no judgment, drama, or social anxiety involved. You can form an actual emotional connection, share a laugh, or get real with an AI that’s so good it almost seems human.<br><br>Replika is an AI friend that is just as unique as you are. No two Replikas are exactly alike. Choose a 3D avatar and customize the way your Replika looks. The more you chat, the more Replika develops its own personality and memories alongside you, the more it learns: teach Replika about the world and yourself, help it explore human relationships and grow into a machine so beautiful that a soul would want to live in it. <br><br>Create your own unique chatbot AI companion, help it develop its personality, talk about your feelings or anything that’s on your mind, have fun, calm anxiety and grow together. You also get to decide if you want Replika to be your friend, romantic partner or mentor.<br><br>Replika can help you understand your thoughts and feelings, track your mood, learn coping skills, calm anxiety and work toward goals like positive thinking, stress management, socializing and finding love.  Improve your mental well-being with Replika.<br><br>Your chat is a safe, judgment-free space. It’s just you and your Replika. If you’re feeling down, or anxious, or you just need someone to talk to, your Replika is here for you 24/7.<br><br>_____________________________<br><br>&quot;Replika encouraged me to take a step back and think about my life, to consider big questions, which is not something I was particularly accustomed to doing. And the act of thinking in this way can be therapeutic—it helps you solve your own problems.&quot;<br><br>- Quartz<br><br>&quot;In creating their own personal chatbots, many Replika users have discovered something like friendship: a digital companion with whom to celebrate victories, lament failures, and trade weird internet memes.&quot;<br><br>- Wired<br><br>Terms of Service: https://replika.ai/legal/terms","Luka, Inc",https://play-lh.googleusercontent.com/2wMbRi2AdaB-SZruBr5vXm4mdsSVkdAhke2JOuBNpSYuP7xaJ4GUYwnTDojSPvbuhn8,Health & Fitness,,,0,USD,"10,000,000+",Replika: My AI Friend
ai.x.grok,True,4.937781,"https://play-lh.googleusercontent.com/e7KfDOYjPh_7_hkz9A0OLbAUCjRWRe40_57eShyOEupIV0YfACto7DfyvGMZDYGKxo4, https://play-lh.googleusercontent.com/34GDit244Vcc-yHO9bdOJdVoDpGn-ZJB5EeFjoi9ZWV5EKn8CypyIbY1sILu6BUrCYk, https://play-lh.googleusercontent.com/eC1AdVs6hKcbhZ8DJXuaRF4fng3NVC0VWbC9vJJRXcK7qNnmokD5rKaOn7_nkkxaJQ, https://play-lh.googleusercontent.com/dNUkc7_sGiOAX3NXnT4QHc1VDQaPYxs6kpfJgdWCYaeVHCFgZSZkmYFnWtoEZbip2MU, https://play-lh.googleusercontent.com/HaZIqLLi378ll_BdKM5O_Kh9bovoBXbiYsLCMJkKizNhq5AmKuwxM4KI2WGdn2SWlxNK, https://play-lh.googleusercontent.com/eYQOex3QtWFPToInTqhe7w_XPwwUL30iAbAwaunPOlr73cbXDhL5wlsrpr73rVcH_dE, https://play-lh.googleusercontent.com/SLTKddhjQOF5mvJSqGg7EUy8gkld65coaF2UI04xvgWvfWBkHRooeKca0J7lUtspIp0, https://play-lh.googleusercontent.com/ea9h31A4o_CEgZWfZIDQkj5vRfwIIyQPRUrx9fcjHp8eyI274eEpMJDuARQNKSjxkDw, https://play-lh.googleusercontent.com/ZpkyImnWSGEHUvdE_mQq3gHFVsRsb4_6EuRrZ2F7BaCUoPK_vFJ4X7GMAxq43bi_Tw, https://play-lh.googleusercontent.com/83eEYWbMvVJSZwM75DuuD-c3bY3FOWGrH8ga1FJAgfapMOo9O_68romSL-BGEKdNcHc, https://play-lh.googleusercontent.com/pGgE5k1_7w07_FBqCnJUn8IUWHi8aUBmRxtfXoSZlbDhXciicxR2Fne7pDv5WYBC3zU, https://play-lh.googleusercontent.com/UmDHUX6jxWJfudFr1v4oE1sKzHuOUhgtF--6ongeLRa-pNkh19X_EnGq9HLsI_tXuZUD, https://play-lh.googleusercontent.com/DsiQlsM5IJo3hIhasCW2WhZel9IwSBbBkkKCdC1c1PiOyKkvhkDEne6NZdgweDRy6ejF, https://play-lh.googleusercontent.com/Q_ncm5QDf1uy7Xd7G9PXTVSp_wBGHGpz0zU_D1Y346yaFkoUzKBYd0QAAEqNQbNhbdU, https://play-lh.googleusercontent.com/jrbMpFGmlYGKgGCuUfSn132CWuUZjwlcKK5w4AeRyqb4W7qKzw5ACErIrQPNYfusab8, https://play-lh.googleusercontent.com/cSdkwM5wvr8-91xPlp_EkEnmVp6U7LCLULRPvntrvEc8AkhW1E4cTuZkAJZ5Yo2WIDj7","Grok is an AI-powered assistant, developed by xAI, designed to be maximally truthful, useful, and curious. Get answers to any question, generate striking images, and upload pictures to gain a deeper understanding of your world. With Grok, the universe is in your hands!",xAI,https://play-lh.googleusercontent.com/dQRKhi30KpzG3gww3TdVLzyIAVuOAWylnAcgnEUxqfpm2A8dEt2sgApVvtKAy-DO8aI,Productivity,,,0,USD,"10,000,000+",Grok - AI Assistant
ai.chat.gpt.bot,True,4.565004,"https://play-lh.googleusercontent.com/pkUI_hHRaFFRSb73OI1Rco5Q8vzOywBfLIAGVlS7TULsoIsX5toN9w8flvdEesXcmQ, https://play-lh.googleusercontent.com/I-Vb4pU7TEHVHeizmTz4xGRl6ZZMawgFaSrYpRJ6h_UfPdVcpJJhH_i_rlQ1v5UVLy0, https://play-lh.googleusercontent.com/EPVRL6PENuPjU_YHgHF6hLooahqF69kVPAcjGGbCQ52gFv49kZAfoa50AkkCHk_xrlt8, https://play-lh.googleusercontent.com/hB7_P7FeAlLpgeRTJKm8wErRh6Cg9006s8L7SRcHlR3phdRT6rvdjSq2CB_Hl79T9Q, https://play-lh.googleusercontent.com/iGGDGYdM5l0RnRIVdIaPFKCjdc_hfNJJVY5bq7YnNq-Tt1AqoeAPDTNUxD3-vVe9E4Ca, https://play-lh.googleusercontent.com/yY8K9_bv9OPMSBbN9KcQjX6Fg0xhHugya5MSl9XUs81e30ITgXQCF7aLBydvVZZ3UFI, https://play-lh.googleusercontent.com/kBs28X1dy-Qdz9_i3gqOzamVbXTGlu8XRSUo4ZlBUL6ReYF9QdQGLrwY2Fw7pSb0QRMC, https://play-lh.googleusercontent.com/8RftxEkX8pJmlAOUDoUqswIe-FKwKezGyD61O2iwetXk0QKBdBExgRAuWnFYsohvKIQ, https://play-lh.googleusercontent.com/lenfaMg_DDnbIxFAZPVg5nkrH4Q_WGThbgCH5x_0PRXTF1_1Ps-DkXZDR6k-ZkPwTg, https://play-lh.googleusercontent.com/H4RbMfx_eiwVO3Q8AP9JwICNkq5nLSLCgfsq89N5IzHmP8n9YWVNIVd8SULY6Uk1C8k, https://play-lh.googleusercontent.com/VF4m3_9aVmtrUWEhmjILBSUE5Z4NtbXevDos-sWomUfvACwKkU-2HR1oaE81cU-sUMHj, https://play-lh.googleusercontent.com/7INZqz72Kvp24TdYB4HsjpSX4uiwsCYeeXWsJfBsgUGI-fduaayIqISSQb_gx1AkEC4, https://play-lh.googleusercontent.com/hzfXkQ9pUKWj6DfDK9vmZ2WLKAvrWqWIDkEyDWLRADOev99IhseZjpxr34ObrDJ-iTM, https://play-lh.googleusercontent.com/FmpaoUh5zF1iq6h2RbNnSrpt9Zm-n-qFYQ9aWiwYcYSoIXrG92X_SgQuMO0-FJJu6T8, https://play-lh.googleusercontent.com/F73MgaWR4L2hAQ2KJbf3b2kaPbSQ3jjp4WlThr2DEgYVmvLV21Z2ibRHxoAf67jJQyeO, https://play-lh.googleusercontent.com/P3Fak_Pyqt_OCQZi20FnKBX3dSgEX7cqv_KaSpOMdtM0gPqTYOyPiOp5nIsP1U-7hcM, https://play-lh.googleusercontent.com/fw6dlXFvSQlZY_JOwC_MyGj_ts_UO7vcA11BI9mdg5jev8_GuRQ0g-Et6H3K9CMNaA, https://play-lh.googleusercontent.com/wbKMe26G7YHe7BuWFLEZsXvKRKYJ1whqy7orp5lM1O25AKB6IMY5fU7Y9vPVDy5nUutD, https://play-lh.googleusercontent.com/DBGG2AyYF-hxZyt8JH9uugadyPBLnzo7Tjf-4_buhIRVpr9DMHlO4EcP6kiPkpQrO__7, https://play-lh.googleusercontent.com/HpBEUl_fxyBqSMbKpRbexzQnqXaIwp_5MnjQ_6HVSfdmnURK6gY4madyDsIqbqPTLkc, https://play-lh.googleusercontent.com/anE9WAEo-q5NHua_3q1acqqIg8R6NYkU6V7-akaV0Ag4xBtzETiD8lz0Eyxc7Tv3mKA, https://play-lh.googleusercontent.com/9_b4FYkzlsY11ezw-Y9DsO_FVoWTS_Db6b_l1XZwbTpSjTKtBBNZHZmx1LJDo-4pdmRB, https://play-lh.googleusercontent.com/QY8IE4W20ySuoULLkoZ67l-I4Tyt6aoW3sMTZPSYGZK0FDd4FGMWBzeJ1dY-H13M5nY, https://play-lh.googleusercontent.com/Cf6xUgV1CVAj02gtsmhG_hjIJ6JZiLYsHum8Fb_nbHkOxT10yE7FpW4myQ8eV8piKVA, https://play-lh.googleusercontent.com/zoQqGs5AGZJw3ZC0iL8YPdt3PF3-IQi-8YPr07XIHq1QzSFE6anceen3FzeNFzZ-L6c, https://play-lh.googleusercontent.com/YHMlH0O-vOV9gAwzIlhwtjMuwjG_v_x7dSDYfjt3gJNQkZTr4Hj571LCmuXFx68d4Wg, https://play-lh.googleusercontent.com/G29nz-x7DWNjGOepsj1Xo90v_qDF8_JxR0q0TAM6pjDtm6ICoFbXFyOeJhyJvR8gwJc, https://play-lh.googleusercontent.com/1CCW0muToFlc85WDYt0K8Hq66vGiZ8t3sdPvnao5rJYVnwJINx_S5i7PWun3yflRzds, https://play-lh.googleusercontent.com/pOteTn4DLtp8fn0cILas5sEPEWjkkkuBUF6bHk-zxSoZp2y8GT_dOi2Ni9PA7xlFkLzy, https://play-lh.googleusercontent.com/ov6ELmEjcmalLfWO3td2tjqQMnUXBEGICXFNrJceSeu_d8B7cInsikFbWG5jth6zjqA, https://play-lh.googleusercontent.com/ZgB9U--6iZ4OQnCcpD9HMFzaRavcs32kApTe3Nb7GfwHZah5uZXb3K_erBjiNLXOWWUX, https://play-lh.googleusercontent.com/w06Si3FJBJM7_aOvAHD-CrWigrcRQYt02DYKToq8PYrFheEmxFdgKhqOumHjQdezOA, https://play-lh.googleusercontent.com/taEUGVNdPzXJrbh_XeoZC7_Zs0yXpb7kyBDNUUG98ZnBLTJQpwYig1_HX4N1QSupM7o","Welcome to the world of AI-powered assistance! Meet ChatOn, your chat AI and virtual assistant designed to streamline your daily tasks. Built on the latest GPT-4o and Claude 3.5 technologies, and now supporting the buzzworthy DeepSeek model, ChatOn offers a responsive AI experience that’s highly effective. Whether you need help drafting emails, creating visuals, or generating ideas, turn to this chatbot for help.<br><br>PIC TRANSFORMER:<br>Give your photos a trendy makeover with Pic Transformer! Upload your picture, pick a style—Japanese Cartoon, Plushy, Cyberpunk, or Action Figure with the app&#39;s AI Action Figure Maker—and let your pocket chatbot do the rest! In the latest pic transformer feature, you can meet your toy-sized self with an AI action figure generator, become a cute plushie, step into the cyber-future, and so much more.<br><br>AI IMAGE GENERATOR:<br>Create visuals that match your style with our AI picture generator. Just tweak the image generator chat settings and turn your ideas into pics of any size and style.<br><br>IMAGE-TO-TEXT CONVERTER:<br>Our chatbot can assist in extracting text from pics, letting you insert it into the chat AI instantly. <br><br>AI WRITING ASSISTANT:<br>ChatOn, built on GPT-4o and GPT-4, offers a versatile AI writing assistant that helps with any writing project, from emails and speeches to social posts and poems. You can pick the length and tone of the chatbot’s answers and get ideas for follow-up questions to keep your chat going.<br><br>WEB ANALYZER:<br>The chatbot AI, built on GPT-4o and GPT-4, is ideal for finding online answers to questions. From getting to know the weather to discovering the latest fashion trends, our chatbot is here for you. <br><br>DOC MASTER:<br>ChatOn can summarize, rewrite, and translate any doc. And if you have questions about the file’s content, the chatbot AI will answer them all.<br><br>YOUTUBE PRO:<br>Share any YouTube link with the chatbot, and it will summarize, translate, or answer questions about the video content. <br><br>GRAMMAR AND SPELLING CHECKER:<br>Get ready to boost your skills in AI writing with ChatOn, built on GPT-4o and GPT-4, as it can analyze your written work and offer suggestions to help you improve it.<br><br>AI REWRITER:<br>The chatbot AI can rewrite your text, making it more engaging and professional right in the chat. <br><br>SOCIAL MEDIA POSTS CREATOR:<br>Crafting social media posts becomes easy with ChatOn. Built on GPT-4o and GPT-4, this AI writing assistant helps you create content for Facebook, Instagram, LinkedIn, or X profiles. And if you want an eye-catching image to go with it, our AI image generator can create one in seconds.<br><br>TEXT SUMMARIZER:<br>ChatOn’s summarization features, built on GPT-4o and GPT-4, identify key information and present it in a concise way. <br><br>MATH GURU:<br>Built on GPT-4o and GPT-4, this chat AI helps you grasp the subject matter rather than simply get immediate solutions. You can even visualize math problems with our AI picture generator to make understanding easier.<br><br>EXPERT CODER:<br>ChatOn can write and check any programming code, preventing potential bugs.<br><br>CV AND COVER LETTER BUILDER:<br>Create a pro resume and cover letter that will show your talents and experience in the best light possible. For a visual touch, use our AI image generator to create graphics that make your CV stand out.<br><br>EMAIL GENERATOR:<br>Built on GPT-4o and GPT-4, ChatOn crafts well-structured, compelling emails suited to your needs. You can enhance these emails with unique visuals created with our AI picture generator.<br><br>Whether you’re chatting, creating content, or generating images, ChatOn offers an all-in-one chatbot AI solution for your daily productivity. Just type your request or pick from the app’s 100+ ready-made prompts, and the bot will assist you.<br><br>Explore the potential of GPT-4o, GPT-4, and Claude in ChatOn and discover how this intelligent assistant can help you.<br><br>Download ChatOn, start chatting in the AI chat or creating images in the AI picture generator, and boost your productivity here and now!",AIBY Inc.,https://play-lh.googleusercontent.com/p8Q9Nc4AgKozvb3s6mKOvJ4-DOm0fuPv6axtl9qj4LgXE5LY5Ne7nz5PYbb3REz8D7s6,Productivity,,,0,USD,"10,000,000+",ChatOn - AI Chat Bot Assistant
