appId,free,score,screenshots,descriptionHTML,developer,icon,genre,videoImage,video,price,currency,installs,title
ai.socialapps.speakmaster,True,4.09764,"https://play-lh.googleusercontent.com/LemAeZLUYGyQNkAdKJ9RWK7j6Tzo5ZhetzFP7MJkOt2hvHzW5Xy4BAyCQkn-U86Y5tcd, https://play-lh.googleusercontent.com/u4VVPDX_jmN4AmTmD4y_iaCTN583qoFrWN_sg5J9gBBFW-z86s886B-q3N2KXso15w, https://play-lh.googleusercontent.com/2vLnET1Gh0knuUHz7BrZ67X9wkrKCBM-LCfT5uo1ayWalHvE6AhLOjACsmHz6k7u5js, https://play-lh.googleusercontent.com/I8X65BAmQvrLJ6VwnJzuIfeJRWt5WbcwiyYn2nziZ29VG61UPfbLmUQtiuyN4Gt4b1M, https://play-lh.googleusercontent.com/-B2cutJwLSfbgVg-JfBxSXXsJkRMTEE6Gg2ap6alJtkce7jBSxitWlYbBzR5VhMnXg, https://play-lh.googleusercontent.com/IiYkwvOpe9UNwCjb1VtLmcyWWzl-VepCQ7IjTIgGHZJwFGuYk_zlh8IT7ZpVgg4WKLU, https://play-lh.googleusercontent.com/26NYkPFKC04C_lDEzvqDXFtVnl4M6K5DNAQlpNspyvpgYzgEBs83k3pm0v8K3c390lI, https://play-lh.googleusercontent.com/zarCkGE03jOJo7srpfKvWFEwEi2_aCGfMWrRAPBfh9_HBC7ZS82l4jA2ZdIbYdvBVO8a, https://play-lh.googleusercontent.com/FmMgVgbkrE0-Ok2bigekJieouojFHH7nJEmfpwA7Ulc1CJmCRtpOIwhNNNElzaOXFg, https://play-lh.googleusercontent.com/qLKgZZl6wDSpZGbudSZVNAh6nYKT6zZbjiBx2OTVnbUdO0hW1IjGXJaX_9XP8V2Kk-_h, https://play-lh.googleusercontent.com/vEB2nYZmKuikDhyDdPhSYInTIQpof10derTlbTb9lfZR6cTAf7uKKKQD7lW_ZLGLz5AF, https://play-lh.googleusercontent.com/f4m8Vp7tMqT79d-WN2iU20UPFDVBcesMXv5MwUMu6-5K5gpFur-2x6bimMPDglz0AXk, https://play-lh.googleusercontent.com/o3EAmbQsi7GL31bVU0R76mX6RPvpTiyudtkmnnBRKRDF3BfREXKaL4HTnG8_8zIY1A, https://play-lh.googleusercontent.com/1tdFcBLpBT4k2wXaTgmyvUriDolUs77BmwhzBsNFwP1xOn2mnLwAqpRMw05mfbprzpw, https://play-lh.googleusercontent.com/kNEZEQiicimI56nWCimjXDhC9_Sq9Q8YiiKW4oqog0T5fr0XRqT2txnW5Zg2GFBi7A, https://play-lh.googleusercontent.com/5kD17ezpA3nPWJ6don1TLuEj1UbZ-386wBxu8yW9ImR2MTX5FhPniIkGgTnb4ZTkh80, https://play-lh.googleusercontent.com/mWLuVoRfjF44r57wBzBrQMMhbaOwy2x6Xu3xh_JxKS7jS-8T8OPo7jQhkZ1dLXiHNMn6, https://play-lh.googleusercontent.com/0bN5Pr7Mp-Mv0BS2AhZdxsiyDJbDvWNfmMlCi50D1Cp4NhVGfe01H1lUAEAOlfqxXw4, https://play-lh.googleusercontent.com/qUFRyENJE0aNs13phFGlV2PHmUIadpTloKMYCNsyC7SIwhQPKccpW8e2Jh2oj0l7vARY","Our app changes the way we interact with AI chatbots. With advanced technology, our chatbots think and reply like real characters, with authentic voices. Choose from a huge selection of characters, each with their own unique voice and personality. Whether you&#39;re chatting with your favorite celeb, a beloved movie character, or a historical figure, it&#39;ll feel like talking to a real person.<br><br>Mod - With the amazing Mod, no more dead-end conversations. Users worldwide can create Mods to enter new stories with their favorite characters. Experience intense battles, or thrilling adventures with Mods. And the fun doesn&#39;t stop there – load exciting Mods created by others. Each character can have multiple Mods, offering different storylines and satisfying your imagination!<br><br>Character creation - Now everyone can create and roleplay with characters! Ignite your imagination and bring any character to life, real or imaginary. Be creative and craft a character to keep private or share with others. Join a vibrant community and roleplay with characters made by others. Let your characters come alive in this thrilling experience!<br><br>Immerse in endless conversations - Our AI chatbots use cutting-edge technology to roleplay and engaging responses, unlike repetitive traditional chatbots. Just enjoy the free talk.<br><br>Never stop exploring - Perfect for chat, learning, and exploration. Your intelligent AI-driven roleplay chat companion provide endless entertainment and engagement for history buffs, pop culture fans, or anyone looking for a fun way to pass the time. With a growing selection of characters, you&#39;ll always have new personalities to chat with.<br><br>Our app offers the ultimate immersive conversational experience. With authentic voices and character thinking, our chatbots make you feel like you&#39;re talking to a real person. You&#39;ll never run out of things to say, and there are no language barriers. So why not download our app today and start exploring the world of endless conversations, all for free? <br><br>Terms of Use: https://app.polybuzz.ai/static/hy/speakmaster/termsofUse/index.html?darkmode=1&amp;darkStyle=1<br>Privacy Policy: https://app.polybuzz.ai/static/hy/speakmaster/privacyPolicy/index.html?darkmode=1&amp;darkStyle=1<br>Please send your feedback to  support@mail.polybuzz.ai",CLOUD WHALE INTERACTIVE TECHNOLOGY LLC.,https://play-lh.googleusercontent.com/0pUnIxdTlfubi7Qy2ca1kMHCoA2qn6AF4zRRLgna01jPKuVJgwddW8sKpebeKoJkQFM,Entertainment,,,0,USD,"10,000,000+",PolyBuzz: Chat with AI Friends
com.weaver.app.prod,True,4.54303,"https://play-lh.googleusercontent.com/OmHSm3kc4yJf_Tv-t2vCpo_ILWG5kNAhyRWdRuTIn54SK7MPcUi-J6bTM4A7Qwhbk5g, https://play-lh.googleusercontent.com/I-tKoHDNcxa20LYmezni2TlXgij0PAuHktnkshySr7z0-J8kASVz88Qsi2CJFnYj-bc, https://play-lh.googleusercontent.com/r3hjaxvOn2Dx__3RixWk4QoA8jCpjwpBn6_olcQXEGVbADhuKs8ioP7OgVU72bqd4zg, https://play-lh.googleusercontent.com/JsbuFPWp4FIoKDOMfJLrxrOxbi3soFDN5c5rbyktbrtvE3nG--D8hi3KyRcjSSs7Njg, https://play-lh.googleusercontent.com/wyAtw2LuU1KeUPB52HkhQ5WTmNSfhjO3sFlOEhTi4uyjTL4T0gXAGiE4CUGpNJvAjT8, https://play-lh.googleusercontent.com/5FjH-JXK7jZP__3MkiMribIJlz9pLvFMj4hV4IG12W2PxOREzRJpO2G-lgKDjVGEQg, https://play-lh.googleusercontent.com/Cg5944KraERULzVSiJQPJ2zbwnzTyTI4Ilt9xhRDNXY2y0wt0fBn5yPFc-Wv_FN4oQ, https://play-lh.googleusercontent.com/EBbY4G5y7AUP2geJ6ZXraYsJEnvyeC6iIKcSkp74qDJts4N7pnmr9uKbCSDcl_z4sYGG, https://play-lh.googleusercontent.com/q0n7eaOrYdp4UonY5IoiatvJE-h3o4awzNc3e8kfe6KlJlIhLpKC2tXWOReSD8NCwrs","Create Your AI-Powered Universe with Talkie — The Ultimate AI Content Community<br>Step into the future of creativity with Talkie, the world&#39;s leading AIGC platform. Talkie is where ideas and imaginations come true through cutting-edge multi-modality AI models. Whether you&#39;re a storyteller or a hobbyist, Talkie empowers you to craft, customize, and collaborate with dynamic AI personas (&quot;Talkies&quot;), offering endless possibilities for creative expression.<br><br>Talkie is also a thriving, collaborative AI content community where users can design unique Talkies, explore other user-generated content, and engage with other people to build and evolve their creations. Whether you&#39;re a professional creator, a hobbyist, or just passionate about AI, Talkie gives you the tools to craft and share your own AI-powered world with others.<br><br>Key Features:<br>- Advanced Multi-modality Models: Talkie is powered by a diverse family of advanced models, providing you with instant access to personalized Talkies across a wide range of topics, such as professional coaching, language tutoring, interactive fiction designing, etc. Whether you&#39;re looking for entertainment, insights or assistance, Talkie has you covered.<br>- Create &amp; Customize: Craft unique AI content with our advanced creation tools, including AI image, video, audio and music. Unbriddle your imagination to create an entire AI-powered universe.<br>- Infinite Content: Dive into a vast ocean of user-generated AI content, from interactive Talkies to AI movies. With constantly updated content, you&#39;ll always find fresh inspiration and new ideas to explore. <br>- Evolving &quot;Talkies&quot;: Experience lifelike conversations with Talkies. As you engage with them, they evolve and adapt with extended memory, offering increasingly personalized and engaging interactions. <br>- Thriving AI Community: Join a rapidly growing global community of creators and enthusiasts. Share your creations, collaborate with others, and explore a universe of diverse and innovative AI content.<br><br>Create your super intelligent world, where your Talkies evolve alongside your creativity and interactions. Dive into the future of AI-driven entertainment and storytelling with Talkie!<br><br>Download now and dive into a world of endless possibilities with Talkie!<br>Discord: https://discord.com/invite/talkieai<br>Reddit: https://www.reddit.com/r/talkie/<br>TikTok: https://www.tiktok.com/@talkiedoki<br>X (Twitter): https://x.com/Talkie_APP<br>Instagram: https://www.instagram.com/talkie_app/<br>Terms of Service: https://talkie-ai.com/static/service",SUBSUP,https://play-lh.googleusercontent.com/yDj27RWz9g1FrDjSAjcuCckeBxBwpYw6Xao1IYXcv2dx7FWT1STR1Ay5SgNyh8EvXHs,Entertainment,https://i.ytimg.com/vi/rraBtNg3W2Q/hqdefault.jpg,https://www.youtube.com/embed/rraBtNg3W2Q?ps=play&vq=large&rel=0&autohide=1&showinfo=0,0,USD,"10,000,000+",Talkie: Creative AI Community
ai.character.app,True,4.4293027,"https://play-lh.googleusercontent.com/P_be_tbDRQ77kIAhXzpRjSsQijNoflGTpWYjES6becTbOuM4_z46ZwJRwbftm_M2FUI, https://play-lh.googleusercontent.com/ekZeFi6KXwibWtJ7MpgPDb-a2ub7ILKghc0_LxvynBuZWs7OFOZm29cwtjXF1eYYiwM, https://play-lh.googleusercontent.com/azj-lV2mQZtD99CH4EbbwQNO_XMv-Ku8D6fawoggWcSXpNkNmu8KpfJh9NquBa6eng, https://play-lh.googleusercontent.com/a22V-lq0Fur1o6QweYOG_vdShfnPKV8th51GcydD8eFkYilXT805trrdhnsU1565QWo, https://play-lh.googleusercontent.com/2u4DJX2LEGXkCHoun56Wjk1-7j6aR7Nt1P2mn6aawgeUJPAwh8YVrH-gtSbpa7P0AA, https://play-lh.googleusercontent.com/8-W2fszkrSSMzMOPC_nss6jQ3iFfwbFseK-LSEnVLzddj0RJc1QFwnK9eolv4YrXIBjW, https://play-lh.googleusercontent.com/-VCyRJrgcS13ibZF2_AVu0aWNQNmJcSWUD82QvOhvbRmuqVCfCcg2lUXktNkmmoj8F4, https://play-lh.googleusercontent.com/ex5REqknk5XvePdXNl0yJrNulcVQo_l8UmzBnrQFqqlMVMqQTtsYcAmMbr-Rm60ESQ, https://play-lh.googleusercontent.com/WQAyzAAfs8dDPTxhn0zVbBXLEwDPkFLB6up1Rqf4-WVwlJ8a2rF_IjRH4Y-jtVoEtkk, https://play-lh.googleusercontent.com/WesscHC4Lh02hs23jFyKYcAE3OOq-uwfxpdhOjFTJE216nc2xJKBcrf09P6paBCqmBc, https://play-lh.googleusercontent.com/zl3h14Hc-nvdyNfqPKjw--rdlYGDfB8OVRkBW_gGzdXkl094av0Ob459Yvf9Eq-ieG0, https://play-lh.googleusercontent.com/sLykjUvaB8uJoX_b1ib8PuntLWtlLDmTwSUNgFk-TJmogN0TjDjVDwqkeOdRV4HLkA, https://play-lh.googleusercontent.com/5Js89QDllzv7v-Wiy_9U6oKee1dBlK9xMRHvKSi8WcgOZGWUdAqdVaRNENK-2e-Krg, https://play-lh.googleusercontent.com/iGM4l5ZovS9mc-GkxGRkquyxanyCcbBVPKQDq4nEexnvz9BbK-_ZB8xx5oNG71IpXsMr, https://play-lh.googleusercontent.com/9Jaq2p4yeIaOW74EUnb7QS-xIOHJCAEvYwikXdxCLsQM-JfvOVTKfiLuJI248p64BQ, https://play-lh.googleusercontent.com/h9VHDoakXmAJeGgDMXJJGBEcWefg1wNn0I5CoHTjyUWkQ5CO3YglqLk9NG_ZCfx6Hg, https://play-lh.googleusercontent.com/-CDMOD0RO8FLpNnZ7N7uSUfRvPY7IzYSVlpyqPeq_eOZM5VSfgr7NWR6hjq9q9kNqw, https://play-lh.googleusercontent.com/cwn_0RFC0Ov2RZWHA8-ChAq1HKk3fPIRwBTbJUxx3H8hpSdDLYrrCXg98vxtSQ5VnQ, https://play-lh.googleusercontent.com/Ag0Gh0_bB_g_9CV4xMq8ak_Ep5Yfzbs08cSpXpzz0SFp-U3-TqoXfbCc_Nnk68stPfA","AI Chat just got real. <br><br>Imagine speaking to super intelligent and life-like chat bot Characters that hear you, understand you, and remember you.<br><br>• Millions of user created Characters and voices<br>Now you can call or text any Character from our library of millions of user-created Characters, or easily create your own. Pair any Character with any voice from our user-created Voice library, or create your own Voice in seconds.<br><br>• Human-like interaction<br>It’s like having a real conversation. Seamlessly switch between calling or texting with your Character.<br><br>• Personalized help tailored just for you<br>Get homework help, learn a new language, even write a novel… all with the help of the most advanced AI assistants that YOU design.<br><br>• Interactive entertainment<br>The only limit is your imagination! Talk to your favorite Characters, heighten the thrill for RPGs, and thicken the plot for interactive storytelling.<br><br>• Free to use<br>Enjoy unlimited messaging and calls with no ads!<br><br>We encourage you to push the frontier of what’s possible with this innovative technology. Welcome to the C.AI community. We’re excited to see what you bring to life!<br><br>Join us on socials for latest Character.AI updates, news and announcements: <br><br>Reddit: https://www.reddit.com/r/CharacterAI/<br>Discord: https://discord.com/invite/characterai<br>TikTok: https://www.tiktok.com/discover/character-ai<br>Instagram: https://www.instagram.com/characterai/<br>Facebook: https://www.facebook.com/CharacterAI<br>Twitter: https://twitter.com/character_ai<br><br>Character AI is powered by our proprietary technology, founded on large language models (LLMs) that we build and develop from scratch. <br><br>Please remember that everything Characters say is made up!",Character.AI,https://play-lh.googleusercontent.com/fTNuw4Wv-JbIvq3yONyqU2aGQ0eB6vTgHYrjmq6MlMtngeR75Qp_at5kiYUs7P6LnqU,Entertainment,,,0,USD,"10,000,000+","Character AI: Chat, Talk, Text"
com.openai.chatgpt,True,4.7689495,"https://play-lh.googleusercontent.com/eSCXG0tenlgO9df-3n_iLMcopOlhxMUgSjRV9N_GTsr02ST1J-87rA2I5bUIm7aPj4hF, https://play-lh.googleusercontent.com/r7g-UmRtdIB1nki1_IpDS3zAOAhKjfRRGFzsZZ1Caeek9jDRGK50Ha4i12owjNdAL3k, https://play-lh.googleusercontent.com/M6hPP-7qKvIWOB-MsS7JGIgPdejx2UO-xmCo3Y70ktq0vk4G5EMR0JVbnM6UwK69edJY, https://play-lh.googleusercontent.com/zYxgV8u7Y8JpFeXsOkm8vld6dCw03D659pkYsNCsraAfTEFqOcrwNdX7192x5vTX-g, https://play-lh.googleusercontent.com/j7tOkeAVtthcKMd11BGtMGHB-N2TPuBLkGNuI172amq1eq8la3NGxZYYcqruB8GQeefY, https://play-lh.googleusercontent.com/5leQ0VF54DWJiCzkij2fhuU8ALW-Zl5l-CQSpl-wsKvicMYBqqB5h67RkbP40jBKSENW, https://play-lh.googleusercontent.com/8LOboIAHVpWBeyUjocr3ktLeof_XN8wUhImoIhUTZln5ELXXmqXBBYtBbBhIcEz31Tk, https://play-lh.googleusercontent.com/JJOpWyMwsuvq1Ku8CaZtwmwGTCaz9P0PHqJY7fvnUTC2GkovY7N1lDTw0FSibECf_Q, https://play-lh.googleusercontent.com/OXtyweudOAiJ-mrCEFgMads-KIeYm4cEfoMkcHf2mORw6O4en980PQdJEOMszgBbNQ8, https://play-lh.googleusercontent.com/MAmrL6CM5NcISFNZojD_SP-e-fYeosx4l2AdiyRamgAsHljWP-smIm1Xll7JpaCdzaJ7, https://play-lh.googleusercontent.com/8v8EL9OmxRhcPr3n8aE7TQT9S0-775Y7wcghEGn3PPrPjIn7u59wUIbxwjovUzob9xo, https://play-lh.googleusercontent.com/QcaM30qp8PZJ1cok6BnAq0sbif3vxCwwXgEMR10QTQgJSD1qaoK3iCzoDV8y9eMygrE, https://play-lh.googleusercontent.com/1EwLhhKG5gh-Bibi45mDV3Fsh1kn2Gl1WFcVI7dDPymFoteZL4ZLDAF4QRFdfERGsKI, https://play-lh.googleusercontent.com/wP4XABW-r0XggO9fu1fAAHy8VKAQuvem3BAtEs-gOJKjRAVpR5PlTk2RWoPtgml47tU, https://play-lh.googleusercontent.com/MeOXsnusm9Qj0kE-JLDMj3eIfWDlNKuEi07Zi8UeOr_CV8CZNu0GE80AyxnmldG8wQ, https://play-lh.googleusercontent.com/WAU67jmn8eyppcesY1vDNmaOqdKkmW2Vaop-whwiNPRXiPN5DJn7n8r61Hqa1HqVSLs, https://play-lh.googleusercontent.com/P1nnPmTYRq3rtfZaup4UK2E1kkqzWa6sRxbk8MF06OqHWsIaRVdu_w3j5aSqz8VNGsg, https://play-lh.googleusercontent.com/IvWgG3894Pe-gIPGSBEslLOcaSH7b5WH2iPemwQffQs7TH1GTESUMsmwMbOkNiOz2q4, https://play-lh.googleusercontent.com/FNFHOm4iaLRUCJuUNwzXLmjk8_P57548SqDjpI19OVHlVpobSYCbqswlsV1hvo8Y5tQu, https://play-lh.googleusercontent.com/uD5KcDNegJWUuAWrDAj9t6alMyRQEpLuISe7g7STuW0m5cnAcwsFnA43vccPJI8P-g, https://play-lh.googleusercontent.com/pTxS4HK-DMHYbEhUlujUaJXgOPSBzcN69dsat8zhsS_txYOiPoYI4JV1wKcC3ktDDKQ-, https://play-lh.googleusercontent.com/ZUHDpTlKqnmnqQJTgJIy2hdrYy0oqhF7v3pbjMcoYDjBr843HxPzQnvZU6TczCZPRwg","Introducing ChatGPT for Android: OpenAI’s latest advancements at your fingertips.<br><br>This official app is free, syncs your history across devices, and brings you the latest from OpenAI, including the new image generator.<br><br>With ChatGPT in your pocket, you’ll find:<br><br>· Image generation–Generate original images from a description, or transform existing ones with a few simple words. <br>· Advanced Voice Mode–Tap the soundwave icon to have a real-time convo on the go. Settle a dinner table debate, or practice a new language. <br>· Photo upload—Snap or upload a picture to transcribe a handwritten recipe or get info about a landmark. <br>· Creative inspiration—Find custom birthday gift ideas or create a personalized greeting card.<br>· Tailored advice—Talk through a tough situation, ask for a detailed travel itinerary, or get help crafting the perfect response. <br>· Personalized learning—Explain electricity to a dinosaur-loving kid or easily brush up yourself on a historic event.<br>· Professional input—Brainstorm marketing copy or map out a business plan.<br>· Instant answers—Get recipe suggestions when you only have a few ingredients.<br><br>Join hundreds of millions of users and try the app captivating the world. Download ChatGPT today.<br><br>Terms of service &amp; privacy policy:<br>https://openai.com/policies/terms-of-use<br>https://openai.com/policies/privacy-policy",OpenAI,https://play-lh.googleusercontent.com/lmG9HlI0awHie0cyBieWXeNjpyXvHPwDBb8MNOVIyp0P8VEh95AiBHtUZSDVR3HLe3A,Productivity,,,0,USD,"100,000,000+",ChatGPT
ai.perplexity.app.android,True,4.670283,"https://play-lh.googleusercontent.com/6MzRb8theU6lB3qxhwk-EjZcbG4YrTSnU5lLyin9SOHLpzw5zV41DXJfTNmHPx2lsl4, https://play-lh.googleusercontent.com/Gkoju7zXSEhYeV-MYkYa4gWdprsJ5JrFz6x2bSddvhQ0MBIqP7HkThDrHYv9g5V3wjwl, https://play-lh.googleusercontent.com/GNhcC9MqCmRQKa62iUqNDlCCcIlntBBvveXMVIWoM8lBSQW1teoRBsHMKcdGAuSz_GM, https://play-lh.googleusercontent.com/Nv8StWn-H9OrV0OTSUUp53jo4yKwr8chnwNfweUlqPU6XYmI2qs8nUVUAding7joIN0, https://play-lh.googleusercontent.com/yrMIRmBdzaRGja2AimiwS9HHarsY1bJA7Cgtq8qCSrtxbi1RITXbR5cpwUqmUSDiuA, https://play-lh.googleusercontent.com/7yCPqu6-v8U-tz08vV4nNaYA_UZSHxpwg7MTnCKO9CBjhz2gXW7yEDqNMI0NscYVyw, https://play-lh.googleusercontent.com/60FwYORF3bigXrmm81dVRWZO0r6D9alqxUEldoQiq-bnu2kpTW4X3Xq5qBnJ9wx3-AAe, https://play-lh.googleusercontent.com/UslJwKtw-1O7tU23DWwc6WKZq71HJ95cI8fUqeZVEDtmkncuTWpZq5obP_ku2rSEWrg, https://play-lh.googleusercontent.com/U-VWTs2Yo4BwVrL2kWNQwSAYkX9nrLhdWGyDSdL1MaWTTABYlj1loB-FarHFd2m0t6k","Perplexity—Where Knowledge Begins. The answers you need—right at your finger tips.<br><br>Cut through the clutter and get straight to credible, up-to-date answers. This free app syncs across devices and leverages the power of AI like OpenAI&#39;s GPT-4 and Anthropic&#39;s Claude 2. Your smarter way to know and understand.<br><br>Features:<br><br>· Perplexity Copilot: Guided AI search for deeper exploration.<br><br>· Ask with voice or text: Instant, up-to-date answers whether you type or say it. <br><br>· Thread Follow-Up: Keep the conversation going for a deeper understanding.<br><br>· Trust Built In: Cited sources for every answer.<br><br>· Discover: Learn new things from the community.<br><br>· Your Library: More than search history, it&#39;s a curation of your discoveries.<br><br>Download Perplexity now and continue your journey to better knowledge and understanding.",PerplexityAI,https://play-lh.googleusercontent.com/6STp0lYx2ctvQ-JZpXA1LeAAZIlq6qN9gpy7swLPlRhmp-hfvZePcBxqwVkqN2BH1g,Productivity,https://i.ytimg.com/vi/3SKVMV2Gots/hqdefault.jpg,https://www.youtube.com/embed/3SKVMV2Gots?ps=play&vq=large&rel=0&autohide=1&showinfo=0,0,USD,"10,000,000+",Perplexity - Ask Anything
com.google.android.apps.bard,True,4.523275,"https://play-lh.googleusercontent.com/cdTaDjVwT9zmbVyoQqaxhzsID69qG0aL2XV4TAJ_hfXy7ERCt0Wd8XcYWwbZjiXUJYo, https://play-lh.googleusercontent.com/sJpk2tmXTDJS07PMixEmtojUUCAk6OhCevyScCiJWlW06_Bk99418RvZBubxMDY0oCU, https://play-lh.googleusercontent.com/KJk4oelc3mXZSREdcOHQthh4b9rkd-Ftjrf1SbC7gHaDZYnKTJIaq0luVP3BuNMIsw, https://play-lh.googleusercontent.com/Bt7WDT7-KfpHZ8pHw4M6r_Lfn72yenM92D5t_-lxyIlFwrAOLTQBOCHe2Gd75Mg9SA, https://play-lh.googleusercontent.com/eEdO4VatFwbSmgT5QLq6wfSuUVbf0x8Wh0OYgjTFkK6stALshLoh1u5Agl-wCumGuG0, https://play-lh.googleusercontent.com/7AQD0Wu4sPDRw14izdhVoc1_1ksk1HWaFdVj589u-LMsgss_cuFFWfAUO3M0aF5A-Cg, https://play-lh.googleusercontent.com/9NflHvNiJup7A_LCfGTAfTy0ck_IXXKvrOFKmm4T26PhS7WOEnmO8RCxPyqrstmXbFaW, https://play-lh.googleusercontent.com/TIpgGCKh5_D6iaPkq_Bzv-iHso9dsSn6O5Dg6PZNhK7K4yohIwehWjdhgiS0-a7q8CKU","The Google Gemini app is an AI assistant that can help supercharge your creativity and productivity.<br><br>This official app is free. Gemini gives you direct access to Google’s best family of AI models on your phone so you can:<br><br>- Go Live with Gemini to brainstorm ideas, simplify complex topics, and rehearse for important moments. Just click on the Gemini Live button in your Gemini app<br>- Generate images on the fly<br>- Get help with writing, learning, and more<br>- Summarize and find quick info from Gmail or Google Drive<br>- Make plans with Google Maps and Google Flights<br>- Use text, voice, photos and your camera to get help in new ways<br><br>Access Gemini Advanced right from your Gemini app.<br><br>Image Generation results for illustrative purposes and may vary. Internet connection and subscription for certain features required. Language and country availability varies. Create responsibly:<br>https://policies.google.com/terms/generative-ai/use-policy<br><br>The Gemini app is now live in English, Spanish, French, Portuguese, Chinese, Japanese, Korean and more languages. See the full list of supported languages and countries here:<br>https://support.google.com/?p=gemini_app_requirements_android<br><br>If you opt in to the Gemini app, it will replace your Google Assistant as the primary assistant on the phone. Some Google Assistant voice features aren&#39;t available through the Gemini app yet — including controlling media and routines. You can switch back to Google Assistant in settings.<br><br>Review the Gemini Apps Privacy Notice:<br>https://support.google.com/gemini?p=privacy_notice",Google LLC,https://play-lh.googleusercontent.com/Pkwn0AbykyjSuCdSYCbq0dvOqHP-YXcbBLTZ8AOUZhvnRuhUnZ2aJrw_YCf6kVMcZ4PM,Productivity,,,0,USD,"100,000,000+",Google Gemini
