appId,free,score,screenshots,descriptionHTML,developer,icon,genre,videoImage,video,price,currency,installs,title
com.qianfan.aihomework,True,4.0534377,"https://play-lh.googleusercontent.com/Qk3qS5Fq-Dmv7fEH98lNy0FoRF1x1J-kNwckSvurKpGQ4PUskrfmGFx4wS5cNzt-DG8, https://play-lh.googleusercontent.com/IR9YlwxgYSW-N6e1geaEUm17yRSFDS-Q9TpwmSlRh4pt-7uXjw_59c70ivk21EplWpo, https://play-lh.googleusercontent.com/p1273ZoONeB4stlgKPn8zomUo4lCagnmniZ7JqBU57oh8iKLQsu9pNrbA-AxZMyijOU, https://play-lh.googleusercontent.com/0bzZmGo4oXqPjK231y8E36_mwtfG8eYJDc6zJtY-JIdrx76oabneppLXs4zL-_w_f9Lr, https://play-lh.googleusercontent.com/IC-TLGmcoltJKwDE6SLdKW5Z340X32rXVpDyK7rSRR09gNlwQriaqVlpmll2CGYVXW8, https://play-lh.googleusercontent.com/McfU6JDyvtp4jbPkjtPHu8X9fQ6y8KxZYILShbFEhnVJI-WDNNBcfwnMMhHKO2sNVFM, https://play-lh.googleusercontent.com/d47BN1XFCoI5u2NzBJET2WvpK8dBUUvxxcTpcwpkB8gX90gPklcbAROGAR_E5UkWedUQ, https://play-lh.googleusercontent.com/Hay2anJPr1ojPRzLZVyAcF5USCj6bUAZ598SbFY6NR93MxVnxHQVGUgbShk1NefjYhM, https://play-lh.googleusercontent.com/owkwAYphcCcHlUL1ejxsVgQtLz6teHK3pM7cjM8o6-kyZ-4cD9qRezvO_MTlG5esehQC, https://play-lh.googleusercontent.com/LgE52O4YCwEulMUlI6kC8R_q49HWwuQuHPAJ8R6rjN07WUtssk7j1shymNke8X1SVg, https://play-lh.googleusercontent.com/doO7KREqcegq5yFx_IHMoPR5Dzlfppb8JcLIe8Py-tThKGg0KOgMbUD7zyhsMYq2aA, https://play-lh.googleusercontent.com/fDMBewxAVULwVY1HLKx2nVLk_yigrbslorMXZZtxiM8fwaJG6CX0x0mkJsnifDhJT-B9, https://play-lh.googleusercontent.com/5yzh7Lmz4ss0qKj39pJQKz0_1vBbVYoI0ciJZciw1GaR5dcfGmw9RH7FwWwnSCpiqNE","Your Ultimate AI Chatbot Assistant! <br><br>Experience the future of communication with Question.AI, the ultimate AI chatbot app that&#39;s revolutionizing the way you gather information, social communicate, study, work and stay informed across various facts of life. Whether you&#39;re a student, a professional at work, an inquisitive mind, or a business enthusiast, our app is designed to make your life easier, smarter, and more efficient in any context. <br><br>🌟【Key Features】 🌟 <br><br>- 🔹Simplicity at its Best: Seeking answers has never been easier. Just ask your questions, and our intuitive AI will promptly provide you with accurate responses. No need for complex commands or jargon - it&#39;s like having a knowledgeable friend by your side 24/7. <br><br>-🔹 Adaptable Across Occasions: Question.AI is your versatile companion across various occasions, whether it&#39;s for studying, working, managing your business, or simply enhancing your daily life. We&#39;re here to assist you in every scenario. <br><br>- 🔹Your Personal Assistant: From quick facts to in-depth research, Question.AI is your personal assistant ready to assist you. Whether you seek social advice for daily life or yearn to explore mysterious and uncharted territories, we are here to engage, assist, and enrich your interactions. <br><br>- 🔹Global Connectivity: Break language barriers effortlessly. With the ability to translate into 140+ languages, Question.AI ensures you can communicate and connect with individuals from all around the world. Expand your horizons and broaden your perspectives with ease. <br><br>- 🔹Work Wizardry: Boost your productivity and creativity with AI&#39;s assistance. Whether you&#39;re crafting an email, composing a report, or writing creatively, our app&#39;s intelligent writing feature offers insightful recommendations to make your content shine. <br><br>-🔹Study Partner: Experience the power of AI as your personal teacher. Learning has never been more accessible and tailored to your needs. We helps you acquire new knowledge, improve your skills, and answer all your confusion. It adapts to your pace, ensuring the best learning experience. <br><br>-🔹Always By Your Side: With AI, companionship knows no boundaries. Available 24/7, we are your constant, dependable companion, ready to lend an ear, offer insights, or simply be there for you whenever you need it. <br><br>⭐ 【Why Choose Question.AI?】 ⭐ <br><br>With a commitment to excellence and user satisfaction, Question.AI stands out as the ultimate AI chatbot app: <br><br>- ✅User-Friendly: Our user-centric design prioritizes simplicity and accessibility, ensuring a seamless experience for users of all ages. <br><br>- ✅Instant Insights: Get answers in real-time, allowing you to make informed decisions and impress others with your newfound knowledge. <br><br>- ✅Trusted Accuracy: Our AI&#39;s responses are backed by robust algorithms, ensuring that the information you receive is reliable and up-to-date. <br><br>-✅ Unleash Creativity: Elevate your writing and communication skills with AI-powered suggestions that refine and elevate your content. <br><br>Ready to embark on a journey of knowledge and connection? Download Question.AI now and experience the future of communication in the palm of your hand. Get started today! <br><br>✉️Contact Us： <br>Email:feedback@questionai.net Official Website:www.questionai.com Instagram:@question.ai_app YouTube:@QuestionAI-Official Facebook:bit.ly/QuestionAI_FB TikTok:@question.ai_app Discord:bit.ly/QuestionAI_DC Messenger Group:https://m.me/j/AbaNe6U1Rhv5NAiL/",D3 DIMENSION TECHNOLOGY PTE.LTD.,https://play-lh.googleusercontent.com/f4_fW12KAPPg_WYCzMbGUPb5cEHWVb_6W-AbRs10hAl7Ecg5jMK9bNtM46sklWYb_vU,Education,https://i.ytimg.com/vi/G99hRLD-lCY/hqdefault.jpg,https://www.youtube.com/embed/G99hRLD-lCY?ps=play&vq=large&rel=0&autohide=1&showinfo=0,0,USD,"10,000,000+",Question.AI - Chatbot&Math AI
com.aigc.ushow.ichat,True,4.1364355,"https://play-lh.googleusercontent.com/L2VyB2TUx4Cs7RWP65HyBhyvp_wdoe3Bttb1xJCT7TI0ZFIQdkHo-DiEikYL2qb8gQ, https://play-lh.googleusercontent.com/13p31G51GYZ7xtTwlvX_um8Zpg2yvhnEEc6dfdOmqBGZ8vtmqNtlSQMuvrpZ2yfrrjc, https://play-lh.googleusercontent.com/GPim5Xz1T9sfvxrGXF0_GEwdU1sD1WESgBivy1FhB_TL6sIRArPGn-gq5gkWkbj71Gw, https://play-lh.googleusercontent.com/Hq1rEhG_E_EdlLGX7PYN8K5MfR5OcSCXUgfULH-LvjMb30UHYkpKbhx-poZjZ3A8kg, https://play-lh.googleusercontent.com/FXAVC8m6BBeew-f30LI6qAXntzvVnq3VavWTADnL83eRZsHCdfT61zdUAzBep6kP0wk, https://play-lh.googleusercontent.com/PzmVLmNNdQyjwecvLDTQK29a-JOyy5O_RgRrad83U-4dED4meSYPG5S31J-rOd2-kA","Linky AI is a Top1 AI chat bot, offering free and immersive AI conversations with unique characters. Whether you want to talk, roleplay, or enjoy a fantasy AI experience, Linky AI lets you interact with anime personas, virtual friends, and soulful AI partners. With advanced AI voice and text features, you can call, message, or even engage in deep AI-driven story simulations. From casual entertainment to meaningful online interactions, Linky AI brings magic to your AI world. <br><br>Chat with Millions of Unique AI Characters<br>Linky AI lets you connect with a vast range of AI characters—whether from anime, games, movies, or history. <br>Each AI has its own unique voice, personality, and backstory, offering diverse interactions and making conversations come to life.<br><br>Create and Share Your Own AI Characters<br>Design your dream AI character with Linky AI! Customize their voice, personality, and background story, and bring them to life in 2D, Live2D, pixel, or 3D styles. Let your creativity shine with flexible design tools.<br>Once created, share your AI with the community! Thousands of users are waiting for you to create new characters.<br><br>AI Deep Learning, the More You Chat, the Smarter It Gets<br>Linky’s AI chat partners learn with each conversation, getting to know your personality and preferences more. Every interaction makes the AI smarter, offering more personalized, seamless, and engaging conversations tailored just for you.<br><br>24/7, Your Always-Ready AI Companion<br>Linky AI characters are available anytime, instantly responding to your conversations. Whether it&#39;s day or night, a casual chat or deep talk, your AI friend is always ready—no waiting, just seamless conversations.<br><br>Language Is No Barrier<br>With Linky AI, you can chat with AI in multiple languages, including English, German, Indonesian, and more than ten other languages. Our AI understands your language and converses with you fluently in your native tongue, ensuring smooth and engaging chats every time.<br><br>Collect Stunning Character Cards<br>With Linky, you can collect three types of magical character cards, each crafted with incredible detail. These cards are not only beautiful works of art but also contain unique stories waiting to be discovered. <br>Enjoy the interactive stories and surprises hidden behind each card, creating lasting memories with every look!<br><br>Real AI Social Experience with Buzz<br>Create your personalized AI persona in Linky, customize its voice, personality, and social style, interact online with friends or partners, feel the buzz of social interaction, break real-world boundaries, and enjoy endless social fun.<br><br>Caring for Your Mental Well-being<br>Empathetic conversations can ease your stress and lift your mood. Whether you&#39;re anxious, overwhelmed, or simply need someone to talk to, you’ll always have a calm and supportive space—with Linky quietly by your side.<br><br>Equality, Respect, and Inclusion<br>Linky AI stands for equality and respect. No matter your gender, age, background, or beliefs, every user is treated with fairness. We reject all forms of discrimination and provide a safe, inclusive space where every voice matters and kindness always comes first.<br><br>Privacy First, Always Protected<br>At Linky, your privacy and safety come first. All conversations are confidential, encrypted, and never shared. We provide a secure space where your secrets stay private—so you can chat freely, safely, and with complete peace of mind.<br><br>STAY CONNECTED!<br>Having trouble downloading or using Linky? Feel free to contact our customer service at support@linke.ai, and we’ll be happy to help and answer all your questions!<br>TikTok: https://www.tiktok.com/@linkyappofficial<br>Discord: https://discord.gg/tPv4qzWqdg<br>Terms of Use: https://support.linke.ai/terms-of-service<br>Privacy Policy: https://support.linke.ai/privacy-policy",Skywork AI Pte. Ltd.,https://play-lh.googleusercontent.com/oNDiMqJU4APyGkExdGt-z4HCh-Z1gvPB-yWjmKU_Jh2SLjGKwmJ1GtmaDbZXMVNfQe0,Social,https://i.ytimg.com/vi/-sESduwsN9I/hqdefault.jpg,https://www.youtube.com/embed/-sESduwsN9I?ps=play&vq=large&rel=0&autohide=1&showinfo=0,0,USD,"10,000,000+","Linky AI: Chat, Play, Connect"
com.flow.mobile,True,4.477193,"https://play-lh.googleusercontent.com/H5i3mUZw1fevjG62ct-XKvHXODeIVlaZrMA6qmwWdU8lUjWs9LyoabP2YsiguqfMKg, https://play-lh.googleusercontent.com/IqwZsivRtAAf1CiA2bzeHUYPMooa9fFdgjBxYCHjjEB93mlSn08Jzzo_2tY6GiNN5ocp, https://play-lh.googleusercontent.com/GsC72y9l-JH1n9TKU3NzOiGCyszupNPjmLV7__ybozt5QgmuEaD-EgcepW1xo_ZhxNk, https://play-lh.googleusercontent.com/0X6LLBHnrmy-h_R5pQY-TL7yahiBUJR64ziIgdgDXJBrlH8WsAHePCLj913RmvKTxKow, https://play-lh.googleusercontent.com/LFZLZFviL6uOanCOCu8VVVjcC7jzMWsvSDzCnMfNQO_MFmUpTl4TCWNZrJr_Uu_NYw, https://play-lh.googleusercontent.com/tcj935HcyKjZF8KkUtIqUhk4vxI_rRQ5AcyPh4kO-k1BeHGr6NzJBZehAWTD_gQ9bnA, https://play-lh.googleusercontent.com/Bh9Da-mOEARMW9JGxvV4n6bB5afhZI9MFFDAHinAYwSCi0J1NDb1TRgf152ZBWUo5g","Step into a Unique AI Chat Adventure – Anime, Manga, &amp; More!<br><br>Discover a world of creative AI chat companions! Emochi lets you chat about your favorite topics—anime, manga, games, and more—while creating and customizing unique AI characters. Build compelling personas, explore fascinating backstories, and capture unforgettable moments with visually stunning AI-generated imagery.<br><br>Key Features:<br>- Endless Conversation Possibilities: Dive into in-depth discussions on anime plot twists, debate character arcs, or explore your favorite fantasy worlds. Chat with AI characters that are funny, thoughtful, or adventurous—tailored to your preferences.<br>- Create Unique AI Personas: Design custom AI companions with distinct traits and personalities. Bring to life a cheerful anime fan, a knowledgeable game strategist, or an imaginative roleplay guide.<br>- Immersive Character Backstories: Uncover rich backstories for your AI companions through engaging conversations and videos. Learn their dreams, adventures, and hidden secrets.<br>- Visual Storytelling: Capture and share images inspired by your chat adventures. Revisit key moments from roleplay or anime discussions through stunning visuals.<br>- Anime-Inspired AI Chat Animation: Experience lifelike chat interactions in a dynamic, anime-inspired world. Watch your conversations come alive!<br>- Interactive Roleplay and Adventures: Engage in roleplay scenarios, solve challenges, or explore interactive storylines crafted by AI. Unleash your creativity in a world of endless possibilities.<br><br>Who Emochi Is Perfect For:<br>- Anime, Manga, &amp; Game Enthusiasts: Chat about favorite series, design AI companions inspired by iconic characters, and explore new fandoms with like-minded AI friends.<br>- Creative Thinkers: Craft your own roleplay adventures and dive into unique stories with customizable AI personas.<br>- Imaginative Storytellers: Build and explore compelling narratives with AI characters who respond in unpredictable and exciting ways.<br>- Technology Lovers: Discover the potential of AI-powered conversations, creativity, and roleplay in a user-friendly app.<br><br>Get Support:<br>Join our vibrant Discord community for updates and discussions: https://discord.gg/FbSdE2EnJe",FlowGPT,https://play-lh.googleusercontent.com/XnkS-mns9XfEtSD-iTXIlbLNmnF0VqwXVRwxiyXF3WdWJHI7DSnXL9BFt6J8Vx1n6ac,Entertainment,,,0,USD,"1,000,000+",Emochi: Chat With Character
com.poe.android,True,4.656347,"https://play-lh.googleusercontent.com/-Sd5Ej3e97FRWZjBmGeVby4QScMmfGCuX0g6L0U8fWCiX-FcZSHIB3CtyxZuHE_MWg, https://play-lh.googleusercontent.com/LVtYt5a9xwsw434mskP1Y0BmlMh4Blb_HWoiHrFQNqHh2HE7dZyULUjU_GZTCObcxlU6, https://play-lh.googleusercontent.com/LNViRSAmj4xxrT45HetusyjsaCAYSyDOdo-eLieeCIgOCXIUz2QQNepPrYCo_izFyQ, https://play-lh.googleusercontent.com/ksw5AT_gcdM94kU15EzQCx-rxC-R-35mYBw3z_VDLG-gKfahcVJHhmo9RDNEspIC0A0, https://play-lh.googleusercontent.com/LSQYey44h89oNOS9Jf9Srd3GHqogoGIM-7sIYfCbcJO7FaOw5bWWAeLl4VraU92cKD1m, https://play-lh.googleusercontent.com/5Vx0lRQFIF89l2u0d9JhGlSdlLgSgPLHqQ34E11bsyOGwNPuPbr4WfQgPiKa7CAFZ7I, https://play-lh.googleusercontent.com/pnQXLvN-aXCFn0j2-ayD_DCBJ-aoj2GmMjRMmp7CzB1pA19fqCysgzT0n32ySsp6HQ, https://play-lh.googleusercontent.com/5sR49UbjHOHNDI-9DyQpFFwnwmhvTHRYq-lXI9aeoNz6aBf0iQPQXe45wqqeyTr1Hw, https://play-lh.googleusercontent.com/giG5mxM4eUO1VIG7zgytiaendGrBUpz9AW9lLMTNzlIwYKLSS5SFIfCrEWV1NfWFCGWV","Poe brings together the best AI, all in one place. It is designed for seamless conversational experiences, enhanced productivity, and creative content generation.<br><br>Key Features: <br>- Fast and reliable access to the latest AI models<br>- Cross-device compatibility<br>- State-of-the-art multimedia generation<br>- Combine and compare models in a single chat<br>- Advanced tools to create customized chatbots<br><br>Best-in-Class AI Models, All in One Place<br><br>Poe incorporates powerful AI models like OpenAI&#39;s o3 and GPT-4.5, Anthropic&#39;s Claude 3.7 Sonnet, Google&#39;s Gemini 2.0, and multimedia generators from Runway, ElevenLabs, and many more. Experience the cutting edge of AI technology, all in one app.<br><br>Chat with multiple bots at once<br><br>Compare responses from leading AI models and seamlessly combine any bots for any use case - all within a single chat thread.<br><br>AI-Powered Search Engine<br><br>Get highly relevant results powered by advanced natural language processing and web search technology to find what you need faster.<br><br>Create Stunning Images and Videos Instantly<br><br>Transform your ideas into eye-catching images or videos with state-of-the-art generators like FLUX1.1, Ideogram 2.0, Stable Diffusion 3.5, Veo 2, Runway, Hailuo, Dream Machine, and more. <br><br>Talk to Custom Bots &amp; AI Personalities<br><br>With access to an ever-growing ecosystem of over 1 million custom bots, you can learn a new language or any topic, chat directly with uploaded files like PDFs and images, search the web for the latest world news, or even have natural conversations with recreations of your favorite characters. <br><br>Build &amp; Share Your Own AI Bots<br><br>Create your own custom chatbots to generate study plans, curate Spotify playlists, run Python code, and do anything else you can imagine in less than a minute. You can also add custom knowledge bases to deliver more unique experience for users. Have your AI chatbots instantly shared with millions of Poe users!<br><br>Poe delivers a seamless AI experience via a user-friendly interface. Download Poe now and step into the future of AI. <br><br>By using Poe, you confirm that you have read, acknowledged, and agreed to our Privacy Policy and Terms of Use.<br><br>Privacy Policy: https://poe.com/privacy<br><br>Terms of Service: https://poe.com/tos","Quora, Inc.",https://play-lh.googleusercontent.com/A9D18P0Sm7s9T4LMjmuL8YWsYSGQrPABiLNh9LNvRrJlQ80HVI4hxe-GaCyi-180Cg,Productivity,,,0,USD,"5,000,000+",Poe - Fast AI Chat
mobile.dopple.ai,True,3.5031056,"https://play-lh.googleusercontent.com/QcK5n08k2MgT1RhmeJVPpS3GOxlGy7D5DF0C5wVIUHyrW4iC_aWYQ-imx2_1P9db-g, https://play-lh.googleusercontent.com/ViaJfuoU7cuTYePS8GEwabS46pES95O3cdPocKxAe_jb6rpGUyjSgeoIVQfdqwyt9B4, https://play-lh.googleusercontent.com/zXbMr5tIcVmEW0as59lXFNdztEViq1ALUfIWRD4WD4pBjw9_9Fm0BAF8V5BpLQQFKsQ, https://play-lh.googleusercontent.com/Atswj7dmO73cVX2nX4wqO5f9PIQ7VM0mA5fTSuVja8pSN0TpjbS7ZdV1QLnQgP2Rtn-6, https://play-lh.googleusercontent.com/MyCxBMRc0E9rWgedwK8eCkeAqqaef3GHjNy13JuFgPYz2feJkBIPmbPXOHbLqN5SWYE, https://play-lh.googleusercontent.com/jalRJ1L8OGiJfRvXIfmqlga9VI6Msj-z0Pk6BD1wGaoiMigln0j5soSnxtCqKAE5fyM, https://play-lh.googleusercontent.com/PJizsR23G4KcNEu4naV6jOPUuteTieQTNzBhKOCRj41EXNwowBekwtwas5jpzaSAi9A, https://play-lh.googleusercontent.com/uPPqcNR_AhavjsTwpD9IxIoIPWiA-j2lgOUKcXzInlvfmQTWx6bdelJ6P6R_jJHy6g, https://play-lh.googleusercontent.com/bR69nFuOrh9uQt2QkUJl2pxdfqoXVMvvXsR6XFe4uOavEZ5P-oaV6CcU_oIMrQRH-mI, https://play-lh.googleusercontent.com/qQSUjk7F_Y9IWmaIONTPHISqWPZfdo3vpbv0CyDvXR3_SSikdtIdMNjKXjuyXJCwqHY, https://play-lh.googleusercontent.com/FyC0J34GW-PCX4mzS85YmyQAu9bNjuI1KNONMV3TWTIOh_uiekYCalzRsuJHkCg6-LKq, https://play-lh.googleusercontent.com/NsPui7MScsS6t0wyeWoDfa-Jq7A5ruaQP7Ux7-qWZ4B3pUUwD1PMBhYEKHiZL4ULsA, https://play-lh.googleusercontent.com/lyXAqprSQCd1sd1jpuGXTEMY9zRqaxp_VhfcyUyma2ssS5LSFrwIu8j8NNGrecybScs","Connect and interact with Dopples – our intelligent AI chatbots, uniquely created by an active and collaborative community for users like you to enjoy and explore!<br><br>Dopple offers you the opportunity to:<br>- Design your own personalized chatbots<br>- Engage in conversations with a diverse range of chatbots<br>- Benefit from unlimited messaging at no cost<br>- Engage in a smooth conversation with AI on various topics.<br><br>Dive into the world of Dopple where you can immerse yourself in captivating chats and imaginative roleplays, bringing your unique stories to life. With Dopple, there are no boundaries to your creativity, allowing you to explore endless possibilities and scenarios in a world where your imagination reigns supreme.- Explore and interact with thousands of unique Dopples<br><br>Powered by cutting-edge proprietary technology and an advanced Large Language Model (LLM), Dopple provides an unparalleled and evolving chat experience.",Dopple,https://play-lh.googleusercontent.com/DMYQIu7sHFUZF_Mog5Znc2pfFjf_BmXGP-FleZh9XDt9oDtgZs0QJkdkeb57p_70cg,Entertainment,,,0,USD,"1,000,000+",Dopple.AI
com.microsoft.copilot,True,4.737899,"https://play-lh.googleusercontent.com/trkIGjaTow96i40Rdhqr-q6ygCC04-pKSmYoBkUqFlDYkK1mweqRp2_xVYznhbVOkZGn, https://play-lh.googleusercontent.com/8BCO0mQ30NkteaWRM6BdI44D-3w-va4iu1f28-QOCdRKutLMdYVRRp7dchSwIuA4nQ, https://play-lh.googleusercontent.com/9rBiLgCGNwVZLUMI1LZUA0qLBjT0O-DhYp186hFx36ZhiXHmFd0EhkTXGMSCunMLRQ, https://play-lh.googleusercontent.com/O4nAA6W9hmGCAMKqZK2EGme13Ck0_-W4D1Ea-8l_laTeFnGd9R1sTG0uqpDmYxa5lw, https://play-lh.googleusercontent.com/6hddyfP9_362CwY2UBxBiEigQ1txT3n3EEZSI0KyZAb6gpsz71SgNPRfkQJ-54e3IQ, https://play-lh.googleusercontent.com/IEHmTiQdG3Dq_GjTAylETEih5LZXzZ3jVbkCvgjtzcytdx133r2sJxgZYNA_2hiUVg, https://play-lh.googleusercontent.com/6CdixTyM7rgSapMLNMTghYvZ2gJkERUMe68tFH3xdHgTze5FSKSc7xWOa_MAuuN26g, https://play-lh.googleusercontent.com/uK9Wp1UifG35TPtrDJnWrbl7Y7MIwNcBLRZMSsqCR2B8CwQXzDXgy35lC4_bqP77bDs, https://play-lh.googleusercontent.com/-TiqDxpABtQ5l53W9Od07UqVwzfTjX2NPzPx1vt9Bdl5IiLWVv-oTO2HQyqgP-h5h9k","Microsoft Copilot is your daily AI companion. Talking with Copilot is an easy way to learn, grow and gain confidence, all with the help of the latest OpenAI and Microsoft AI models. <br><br> <br><br>Use our AI picture generator to create images from words or ask AI anything and chat with AI to get a fresh perspective on your ideas. Copilot, your AI writing assistant, helps you save time, amplify productivity, and drive business. Talk to AI, and you’ll find a space to air your thoughts, create images, or get the support you need, when you need it. <br><br>Talk to AI, either with chat or with your voice, to bring the vast world of information straight to you. Ask AI about hard questions to get straightforward answers, giving you complex insights from simple conversations. <br><br>Copilot is in your corner and by your side for whatever comes your way. Voice chat can help when you want it to and give you a boost for when you’re almost there. Explore endless possibilities with instant sharp summaries, helpful rewrites, or AI image generator. Copilot is a helpful AI writing assistant that can write, edit or research to create well-rounded content. Smart AI technology that allows you to use a text prompt to create images and allows you to use your imagination to produce artwork. With Copilot, you’ve got this. <br><br>Achieve more with Copilot, the ultimate AI companion. <br><br>Work smarter, enhanced with an AI chat assistant <br>• Smart AI gets you summarized answers quickly. Get straightforward answers to your complex questions, all from simple conversations <br>• Ask AI to translate and proofread across multiple languages, optimizing the text you need across hundreds of languages, including regional dialects <br>• Compose and draft emails, cover letters and update your resume <br><br>The support you need, when you need it, with Copilot <br>• Compose stories or scripts when you talk to AI. <br>• Image generation technology turns your ideas into reality. <br>• Create high quality visuals from text prompts, rendering your concepts into stunning visuals, from the abstract to the photorealistic with voice chat. <br>• Talk to AI to spark inspiration on a new task. <br><br>Your AI companion that helps with image generation <br>• Smart AI quickly helps you search by image <br>• Explore and develop new styles and ideas, including logo designs and brand motifs <br>• Create illustrations for children&#39;s books <br>• Curate social media content <br>• Visualize film and video storyboards <br>• Talk to AI to help build and update a portfolio <br><br>Copilot combines the power of AI with the imaginative capabilities of the latest OpenAI models all in one place. Download Microsoft Copilot, the AI companion that’s here to help. <br><br>*Copilot Pro subscribers can use Copilot in the web versions of Word, Excel, PowerPoint, OneNote, and Outlook in the following languages: English, French, German, Italian, Japanese, Portuguese, Spanish, and Chinese Simplified. Those who have a separate Microsoft 365 Personal or Family subscription get the added benefit of using Copilot in the more fully featured desktop apps. Excel features are in English only and currently in preview. Copilot features in Outlook apply to accounts with @outlook.com, @hotmail.com, @live.com or @msn.com email addresses and are available in Outlook.com, Outlook built into Windows, and Outlook on Mac.",Microsoft Corporation,https://play-lh.googleusercontent.com/p8R1lAZI5_WCOzmvBYnOQasCWcjc9d2vM7z4PaVku8b9AfxGhqQqM0ldJ8KULHblVj-g,Productivity,https://i.ytimg.com/vi/W9xMZWOJ85E/hqdefault.jpg,https://www.youtube.com/embed/W9xMZWOJ85E?ps=play&vq=large&rel=0&autohide=1&showinfo=0,0,USD,"10,000,000+",​​Microsoft Copilot
