appId,free,score,screenshots,descriptionHTML,developer,icon,genre,videoImage,video,price,currency,installs,title
chatgpt.ai.chatbot.open.chat.gpt.bot.writer.assistant,True,4.423448,"https://play-lh.googleusercontent.com/2icjzJOi0DrYbAse16-FY0G4HZ5_dyVOVS25cJTrn9HM19z17LV2t3HKoKvzSnktTeg, https://play-lh.googleusercontent.com/uCMqOSSGjWMcDj9DJ6VvfxFUz8bEXeuVIL4Ks3tq_bZne6LVgECi1uqI-d83qBHP5w, https://play-lh.googleusercontent.com/FiLoJ1MPTpDU9g4Vv2y31rfWd-TWt12pUmlTbFj98p_GgXEMNJdoslNrQ0c1tr5mBg, https://play-lh.googleusercontent.com/YBS7FuVTEFgakcvkZ5wWnpsBRQsb-vz3ms0W-vgvV1Q3jU6-oiFum4nLOJdbLyN5Sw, https://play-lh.googleusercontent.com/U_FTzIpRxKOHefbXm_51SZzE108iUtb6WPGkI0IRTOh6PSDUWawyjFzyDTrl1ZPOZLk-, https://play-lh.googleusercontent.com/Y2yX-45up1WANaXDrHyMiA6AG0bkmMu_9_NaD9GYxlmcZXH7dIm6WKJm654m6CgJVok, https://play-lh.googleusercontent.com/Ywlt-QotAzUKb4YQftiOiylcks5fze0aJCzKKB-jMET1k3inklnrr1YE-L81-PbiUldW, https://play-lh.googleusercontent.com/LXYps1kHVYud_Dh6A6a40Nb7OVeRMbrQhGXGYbD2MmuRzK7JrZhoHPvc8Z6H1Bqy6l8, https://play-lh.googleusercontent.com/1-fNDD-X-rZaSxPAJNiVy3ZpvUiv-RoiwC77MswWcrTaIl955ZxG_lFaQDGuX3fnyqs, https://play-lh.googleusercontent.com/qoOgPVXEwE4RIGswrk5hk4VMJYEvb2jKzYu4uc181ti2oAGOFilasqnDtlFit-wOkWc, https://play-lh.googleusercontent.com/j4F88xAySVuK4s7PhU2JesDcWyfJN0PY__vRSKq0xcz0lqNcXD4jvCa5WEjB-MN2Og, https://play-lh.googleusercontent.com/T_DjD6VNRy_XYVhW7wpXMYZbgbdosWXBepJyIibVoFG0pfdd2cI0M1i1-_LagU0OgA, https://play-lh.googleusercontent.com/03auBFAnFZ8QxelPLlN8TDCx8vulJX_R5BcDDyNjm_-Jwey8pGOfEb_7g-Qz70LGayzf, https://play-lh.googleusercontent.com/wj63HMNM0Hc8tKdLUOooTeZI0J5Uslm9_rYd4H3bg8clJgqaS7xs-LGr0eN6eM5tpg, https://play-lh.googleusercontent.com/mbJFBPljnPxnkto_ud2xOzUeVOM1f2ylJxXvPXr5GTMx-I-Q9Y-elD0ZcbF-AYlpxO35, https://play-lh.googleusercontent.com/JYsEA_NxfY9Bef1EGprSfA4TCmTAw6jJFB3Udb2tqC8kdwxlv8MHXJ7_Y6KJYYjSRiF8, https://play-lh.googleusercontent.com/vnVcmMNUn-U3VyaqLj5OySin4A6kHSp4o25rWHeh1NM8bgc35cIoTOJ6swEj2Dk4wiM, https://play-lh.googleusercontent.com/X55t4ydQ1gXOVzCYnuTSDqAlP3lWCe6TK8zIFgDpLlpd2UYODOC1QQX66WNldllfluM, https://play-lh.googleusercontent.com/zuVDxnlqiX0nrrsETg_Cld0vEKFe8ALoRHDSsKtG9PBYB861kpkriwcXq2y-LjNvOw, https://play-lh.googleusercontent.com/UztJNk2Bru1LcttsPEAZ2skYKlOakteVZUcSOOVGvEGZwpp39kE-WQEAjG8BTbf-UQ, https://play-lh.googleusercontent.com/nCRp3qP2tRrcU1iZ2rnsY2enqMMDexeUl-63gKVhvwRnGnWdJQrXWDRczs85ZTUFhYA, https://play-lh.googleusercontent.com/uEZf0HreB3QcsXdTFhbgc04Re0IoQu35rZn_dN6XN7RP7VEUZYBhVf-UF7HmJ7etKCg, https://play-lh.googleusercontent.com/u1D7IKqTSGXdQCF_aycowErTJ3B_7V4tJw5CG7gyt5tz-ZqX_qpvpO1qmRKqK7Dd4g, https://play-lh.googleusercontent.com/n00iPiy645wzzX6-WGiNv2LlAHRRFtbHs13e6m4SitNl7fLJdibMEWHd9VITba8EYQ, https://play-lh.googleusercontent.com/rob5RQl5jKHxGS5zS1vFgh-IAnfiULmVVNBvORGkVKq9Sj_YYMgAn0eQsc183L2dbMOL, https://play-lh.googleusercontent.com/A7mPcZYkND-DMhU-0uRftiGpkHZ-IoV0calm6nMfNe4daIMPRbbKoDXzhmelZhVw14w, https://play-lh.googleusercontent.com/e3nWbPYmOmHez3pgst8NOq_F58sX-G6XSmn4aaCf8N76yN6Lls3PPR4OdIOp6_KLJA, https://play-lh.googleusercontent.com/p_JceHm3DJyfPzRiVQxR3ECbtp3TiCW-V3UtFvqv-_NHhKbBHGQOuyEmOWQnk9jPDTi_, https://play-lh.googleusercontent.com/_7-ToP7JURnQ9BOqs1FAoYIr5rFxOX-jWcuysKiXJww1AVzYIV0n1aG-S5dt9TDYO7A, https://play-lh.googleusercontent.com/EEjGXWzia61niitZycBvogrt5SquOK7_QgNvRWiKeyl6gKAl2qDY6VmV61kVOuIQ0DpF, https://play-lh.googleusercontent.com/0gDwtBnIi2r8uIxewR-UfsdAMof0NH_dBoHXndwL-Ot8-qKBqtXnSmFFf-lkUF3kZA, https://play-lh.googleusercontent.com/tzSoDnlRWSGBCPpXgmcfN4SkWP_1ml98zTXIPgNt4HQ4iAX9o6PC8R9u2bEXvP7WlVI, https://play-lh.googleusercontent.com/9KYDWxrHXZOazPKaL9G2rL84WRfkh1Sp5E1Tr-Y4rcMnoWNZXykSzFPyi6HRBMDw5x5V","Meet Your Ultimate AI Chatbot &amp; Personal Assistant<br>Welcome to ChatBox, your cutting-edge AI chat companion and virtual assistant developed on the most advanced AI chat models. Designed to seamlessly integrate into your daily life, this AI chatbot uses advanced machine learning to enhance productivity and provide instant solutions. Whether you&#39;re looking for help with a task or require answers to complex questions, your AI chatbot leverages the latest AI chat advancements to assist.<br><br>Unlock Endless Possibilities with ChatBox&#39;s Features, Based on AI Chat Technology<br><br>POCKET AI CHATBOT<br>ChatBox leverages the latest AI technology to deliver exceptional assistance. Whether it&#39;s answering complex queries, generating images, or providing detailed explanations, this AI chatbot—developed on DeepSeek V3, GPT-4o, Gemini, and Claude—is your reliable AI companion for a wide range of tasks.<br><br>VOICE CHAT<br>When you just don’t feel like typing, hit up your virtual assistant with the Voice Chat feature! Simply speak your thoughts, and your AI chatbot will handle the rest.<br><br>REAL-TIME SEARCH<br>Stay informed with AI chatbot Real-Time Search, built on GPT-4o mini. Whether it’s trending news or specific queries, your AI chatbot, built on advanced AI chat models, makes sure you stay in the loop with accuracy and speed.<br><br>AI IMAGE GENERATOR<br>Turn your words into stunning AI art! Just describe your vision, and our  AI chatbot-turned-photo generator will bring your ideas to life. The text-to-image feature now supports image upload, making it the ultimate photo editor as well! Want to try the buzzworthy AI anime filter? ChatBox can turn your photo to anime shot in a snap. Looking for the fun Action Figure maker? Just try the AI Action Figure generatior. One pic is all it takes!<br><br>AI VISION<br>Ask anything about your image! Simply upload a picture, and our AI chatbot will provide instant, smart answers about what you see. With AI Vision, your curiosity transforms into clear, easy-to-understand information in just one click.<br><br>AI WRITING ASSISTANT<br>From essays to emails, romantic messages to cover letters, this AI writer—developed on powerful AI chat models—excels at text generation, producing unique rewrites, adjusting tone, checking grammar, and finalizing your writing, all developed on the knowledge base of GPT-4 and GPT-4o.<br><br>COLLECTION OF PROMPTS<br>Access a library of curated prompts for any task—be it scripting a viral video, drafting a CV, or brainstorming creative ideas. These prompts, built on DeepSeek V3, GPT-4, GPT-4o, Gemini, and Claude, unlock inspiration and simplify your workflow effortlessly.<br><br>CREW OF AI ASSISTANTS<br>Take advantage of specialized AI assistants developed on GPT-4 and GPT-4o mini. From legal advice to dating tips or financial guidance, these tools are tailored to fit your needs. Customize your own AI assistant for a truly unique and personal experience.<br><br>AI SUMMARIZER<br>Built on AI chatbot models such as Claude and Gemini, our AI chat app can quickly generate summaries for long texts, webpages, and PDFs.<br><br>DOC CENTER<br>Rewrite, translate, or summarize your files effortlessly with the help of your pocket AI chat! Upload documents in any format: PDFs, Word files, images, and more.<br><br>MUSIC GENERATOR<br>Choose a genre and duration, and let an AI song generator create the perfect soundtrack for your mood or project. The advanced algorithms of AI chatbots ensure exceptional results every time.<br><br>AI STORY GENERATOR<br>This AI story writer, built on the latest AI technologies such as GPT-4 and GPT-4o, can craft illustrated novels for both children and adults, comic books, descriptions, and more.<br><br>Ready to explore this AI assistant’s full range of capabilities and simplify your daily tasks? Download ChatBox, your pocket AI chatbot and AI image generator, built on DeepSeek V3, GPT-4, GPT-4o, Gemini, and Claude, and start achieving your goals faster than ever.",FLORATE LIMITED,https://play-lh.googleusercontent.com/diytq-Jcl-ISnT7itDA4jcefz042_P8FvxgRZGwOb3NUmdEhcGTXKfQ2M4NP_q8sYcE,Productivity,,,0,USD,"1,000,000+",ChatBox: AI Chat Bot Assistant
ai.chat.app,True,4.384411,"https://play-lh.googleusercontent.com/pTHrJNsHwSKJ3fHG0MusJDIt9qOab0y6zmSm7Auydwn-57MXQlI2Y4gb35xBrMqb-qIC, https://play-lh.googleusercontent.com/LvGDskTLTgSNbUeNyb1Srb4fjkyfL2zzQL8-TLtZX7o6gdUjALtvWEEqT_GuulKd1v8, https://play-lh.googleusercontent.com/0Sb9DK5XVIL8ddmMHVyAIYwS_hloonAXN2GvQtvxrAl6eWrPCBWJ_21ZWvatbd3YRcMG, https://play-lh.googleusercontent.com/ZmZ_jGmMnf4mL2Ngkg941zY16bnZQEWvpfxbA74v_ee2kOo7KOrxE2KPsJOlOJOQ-_M, https://play-lh.googleusercontent.com/HSyL4UXMwa5kPyQ0wNqNSeC80LKOml1_YD4HnJJx8FbqFoBdyfs14llF-LQ8peMCft4, https://play-lh.googleusercontent.com/0_En2v0am-DjC9CD2XEB2O9MzivFhrzemgmFGN653EP82jHvTnt01EQ3rHYiLAKgohY, https://play-lh.googleusercontent.com/KdsNWULTx4pB_LkUrcuXF56GyS7EyFo4nnQ-kDuyi2ze7wuuQL12rEiOx3X9chAKk8fZ, https://play-lh.googleusercontent.com/s8e4M0n3fP23bghXJVXezKWA4uaLKMvUZZOshgPJ5klcgyQuLG2nEGwmqQQBcEs6zG8, https://play-lh.googleusercontent.com/tBW9oPs_1Kz3WV-I4b-zBYkldnJjyx4kbVYYMYCAj32VegQ0L6F_u9qpWxyOYxrh6Sc, https://play-lh.googleusercontent.com/W-QyKIm5zBPYdpt6vlXC12j-R1P8mMewYHrlGZUI4E6oJ6V2UtYrKmx2IK6hgZOYWJU, https://play-lh.googleusercontent.com/7Ot1u7cr7bWbbDLDhz7jCnnFSC2_f0EdvAnp4PiUIVMDqFdzrGORIbg-mi5BoFaqs-w, https://play-lh.googleusercontent.com/znIPwmkjHP5KM2tpMJTUDMsPWz8lBBqF9jMgngWobCoFu1CLfaHxF48_CntzM9yNCdE, https://play-lh.googleusercontent.com/nL1L_XFWPkJM-n8ke_cruB6AGc2Vf1fWP6S3c6zsB1WvUx3Dhebvg1mrSqZXLFlAGIJI, https://play-lh.googleusercontent.com/-hJ9Fc6bsqvGxbXWcXspmifn-clq8jqqSXIA9_4bUOHcyndeDVbQT6vjHcxSthW0uw, https://play-lh.googleusercontent.com/dcsndVw8B6E_ofvSpDc9sZYFmT8NV4-Zg-WDEB5AJ6Z6mK0S3L0Q3OyZEOFyRVr-zF-N, https://play-lh.googleusercontent.com/QsnDEi7-FzOpZbsCHYMUhzxBlR0qCw_6_wmH1C3cxTa_oUid4pb38OT0RwfLIRMv_w, https://play-lh.googleusercontent.com/pe2FStF7oR-ned_LPVWy_Dr_ocVDL4D0yvkYNYetJgIyh7ribN1VRV7n1sx_Wa8KbVU, https://play-lh.googleusercontent.com/19sSJ2uJGYW5e4B7QAunt0FDhyIXb8dz4Xr1qldeXFaU-EzVUWSiHenxUIOzZngb5Q, https://play-lh.googleusercontent.com/b_z6cmqpMpOmh0N5KSQAZArckGHBIZGde-16SAUEMu79Br9tiAbgVt-bZC_mCbCStzA, https://play-lh.googleusercontent.com/wKtVlndgilP-wgNvXclNtNbzz0tjnjTx05exm8oNQxNHUlX010mbxDBowVhSy3afxg, https://play-lh.googleusercontent.com/8VAHe2sPzRcjvIYfEA_8CgwofsNe8mk0tqxAgvMomATsXlgEhU2OkGMwiQeoqbbTpgGU, https://play-lh.googleusercontent.com/2V4UD7OA8GBDND34j-iSovTrbkPlLsKg_LFGJPYqD8CCBYNDuEH-Hd7hC-3aYEnQpw, https://play-lh.googleusercontent.com/QqCUVjxBq4srPFYKdcoexcr5vA8oOqeRtDr0xgAJ8AYGIpYWh65AV4lZugC0_cuqqw, https://play-lh.googleusercontent.com/KhAcLcZihMwl6ERJmhLctLd5lYOqeIQmzaKIXN873pRKKb0_SZc5BWE-Rmk7OprSPEE, https://play-lh.googleusercontent.com/0VLQV6S3W3h54zkrbz6jmDqBruW2hqy8pCAZeQLb5081NDVcb_vvNhAyN21ZAyYm6EE","Smart AI Chatbot Assistant, built on GPT-4, DeepSeek, and GPT-4o.<br><br>Have a question? Ask our Smart AI chatbot anything! Chatbot will provide you with instant and accurate information on any topic, all developed on the most advanced AI technology of GPT-4, DeepSeek, and GPT-4o.<br><br>Use the Chatbot to get the assistance you need in your personal or professional life.<br><br>Some use-case examples:<br><br>📄 AI Text Generator<br>Text generation feature of Chatbot AI Assistant was developed on GPT-4 &amp; Google Gemini and DeepSeek. Chatbot can create any kind of text, from creative writing to technical content. Need a story or poem? Just ask! You can use the AI chatbot as an email generator, <br>song composer, AI text writer, and more.<br><br>✍️ AI Essay Writer<br>Chatbot is ready to assist you with all your writing projects, including academic essays, articles and more. Use advanced AI essay writing feature built on GPT-4 &amp; GPT-4o and multiple AI models like Google Gemini &amp; Claude and DeepSeek. They can generate unique articles and essays on any topic within seconds.<br><br>🖼️ AI Image Generator<br>Developed on GPT-4 &amp; GPT-4o and DALL·E, the AI Chatbot&#39;s image generator is state-of-the-art. Your AI Assistant can transform words into images in mere seconds. Whether you want to create AI art or produce realistic-looking images, simply describe your vision, and the AI will generate a unique image instantly.<br><br>🧘Mental Health Support &amp; Guidance<br>Make your mental well-being a priority. AI Chatbot offers a nurturing environment where you can express  your feelings and receive positive affirmations. Customized advice and simple tasks designed to enhance  your mental health are easily accessible through conversation with the AI Chatbot. Experience a mental health companion built on GPT-4o, like no other.<br><br>💪Your Personal Fitness &amp; Health Coach<br>Start your journey toward better health with bespoke fitness guidance and wellness tips. Chatbot built on GPT-4o, is here to lead you through exercises, offer nutritional advice, and sustain your motivation along your path towellness. <br><br>🇮🇹Language Learning Practice<br>Enhance your language skills with our AI Chatbot. Engage in practice conversations, participate in open chats, receive grammar tips, and delve into real-world language scenarios to elevate your proficiency in your chosen language.<br><br>💬 Open-Ended Conversations<br>Answering questions and generating written and visual content aren&#39;t the only capabilities of the Chatbot. You can also engage in open-ended conversations with this AI companion developed on GPT-4 &amp; GPT-4o &amp; Gemini . Chatbot can produce human-like responses on topics ranging from art to rocket science.<br><br>Once you download the app, you will be able to access your Chatbot account and the AI Chatbot on multiple devices, including mobile, web, and desktop.<br><br>Download Chatbot now and gain access to multiple AI models, developed on GPT-4 &amp; GPT-4o &amp; Google Gemini &amp; Claude &amp; DeepSeek, all within a single app.",HubX,https://play-lh.googleusercontent.com/jF6bWOxfObNRYVi5VSy7-o7sVp7yHmsRQAHQ1MvbMsU-O9O-il9OJox64lAatDIx5NQ,Productivity,,,0,USD,"1,000,000+",Chatbot - AI Smart Assistant
com.smartwidgetlabs.chatgpt,True,4.377416,"https://play-lh.googleusercontent.com/E0iIb8405idpPnLCj_8EBO4xgBzqhMG1sWFmRXso4IBqULorJvbH2NbvNO7e5yLCmfU, https://play-lh.googleusercontent.com/DPLFBCY8oGR3jy21hbnJTKeTcK_dNUhDRjJI3FRTtHkFBkHPxYljOBSc2DwAMIWaz4k, https://play-lh.googleusercontent.com/e9079DLuAEZBcfrvtxiCu2EE5nZOYdtiOxegTc4UHolzoEUky1hGeJTwLMhAhGjdR6A, https://play-lh.googleusercontent.com/WK9ECRUK0nII-Iw_dQ7MG6K2ENXFh79MINR7P-H5nhS1sDVdlZ42uiqGlmoP1agjhSlm, https://play-lh.googleusercontent.com/G7Obndq13_W2ayGLkmST-rbJEuCwUlr_ZhKG6ihp35p8nVn81rCEW-RmBgFSX3UZoPrt, https://play-lh.googleusercontent.com/ag_Hx_JwKA6ztnyPQJHdeghELsevVV1dQQUd6oGpnTmIiTfSpknS6IbRwFSGEBU1ZQ, https://play-lh.googleusercontent.com/RDU1GscxsxeukLroLh2HNwOoOgcZsRY_LjHm37G-E8Dm91_H_T8XrjQORZ_woy7XkRo, https://play-lh.googleusercontent.com/ELFSTLVA5i8m0h2invxSNI-gNLO601ZIpUx0S6-IsVo2rrXaPhCNSKYHbP3OeRI-hrg, https://play-lh.googleusercontent.com/-7Bdb7D5XcDInpYlsq7cAbE5kAlejqwsu6_icTSRwCLGSWZdK4e-Lz4pE2rM8ISCq8U, https://play-lh.googleusercontent.com/qTQMNEtSnxbWOn2DShQqyKBUhWmSKFRdRXkgUlY8dlbV5xolBIIlYmFgCiXxJf8-kVw, https://play-lh.googleusercontent.com/0P0i5Hf1lspkHuACaZawExntcG7OnFUH0OivkhLQLHbGyX0jzOnGanY2iPtyJ2h13CY, https://play-lh.googleusercontent.com/F9W9_AfDt5AhniD-TPqfcvhh7mvzaprKUSh-g0iG09H19vAxudtOayKry9DSSFJULDM, https://play-lh.googleusercontent.com/OANCDstQHQOn3GH-EdjSKOzRbXmsLkv45AR1vCIqTlckEwb4PnBhhvysoRUBpfR1Ucw, https://play-lh.googleusercontent.com/pAVL4J-xaSW5UYkwU2ghYmaUG467EuEueVHi5jc7kJZ8HIpyKXHa6TPdAk4yPdoJBw, https://play-lh.googleusercontent.com/ECyAmU9AYKB7d3JKTzUPyuN1BuPGRPbKSDjptNmropjJs7hhdZL1-4x2eWTSwQ6480I, https://play-lh.googleusercontent.com/TLIx6bq8dvEn2Bz7qJG83kXwWB-0dEqdnidGq5ildHkDtXjPVkEgAvuvs_NJkkaqqsQ, https://play-lh.googleusercontent.com/QGURcBJuzCpatm93E8W2t1sQb-l_IzOZnKpSe6OMmZfTKAaAQW5UJBh3qIxEblrULhc, https://play-lh.googleusercontent.com/gjF3l4H-PBtNsIslavkEIPpt3m-NcxYDSz8a98mnwOqhxLR4Dqu_qkDDA6M8DLDEnmQ6, https://play-lh.googleusercontent.com/Y--pMHKZQMIltW21JlsMUJwUm2AqtG5oOLLSnF_3Yf8tM3fie03vCGpRPrHTqmS1tFsx, https://play-lh.googleusercontent.com/Vh616D_weYcO4VAfDLNHIGuLNjKZB5sFeAeZU_mLVUzK-YNuyqXMD0D2caLB-Fbr4OA, https://play-lh.googleusercontent.com/0sJmWnGxyyZoS_2GzJvSBlFLgI5zxZa-fGF2WZiBFAeMknLnR039gEp4cZBSZWZW8co, https://play-lh.googleusercontent.com/qFd0zBNUOZk7gmyKAMDJseN-SAJlpwmSV7D3htcpbMmGgA9UqScHa-qwhIeLOtZBFfg, https://play-lh.googleusercontent.com/NZ9SzVCvokwmOFxRo-lL5QXHs4UnhmukdwSZjmVa-XnDBIloaX72s0GjcgSfMLGsLwi_, https://play-lh.googleusercontent.com/ObNCGkJD0SExZWTOduCVW9IRtuztCZCPo3HIWjeXZLYrjkxJp7eY9N0eLWMLuWNzDKs, https://play-lh.googleusercontent.com/XhTjrrPkFnIz8qgiGFNMGB3wJjiLT9Rx7HH0t9MpyovAtxt8LELg8sc3RnBc1McmKA","Ask AI Chat Smith Smart Assistant latest AI Models anything and get instant answers. Open &amp; Chat with the most advanced AI!<br><br>With the advance artificial intelligence, enjoy a personalized and conversational experience with your Chatbot AI personal assistant. The intuitive and user-friendly interface of Chat Smith, makes it easy to interact with and get informative responses to your questions.<br><br>AI Chatbot Chat Smith provides various helpful smart assistant to choose such as: Business, Content, Writing, Interview, Information, Grammar, Chat with PDF, AI Image Generator, etc<br><br>- AI Chatbot as a Linux Terminal, JavaScript helper to debug &amp; write code, and extract data from text.<br>- Upload your photo and let Chat Smith transform you into a dreamy, hand-painted character. Instantly get your own Ghibli, Manga 2D, Genshin Impact, Anime, and Disney-style pictures<br>- Create unique AI Artwork with AI Image Generator feature<br>- Summarize, Q&amp;A Question, Explain Any Things with a Particular Style<br>- Get Ideas for Decoration, Party Themes, Social media Status, Create Contents marketing, Social Content, Writing Emails for Business<br>- Find Answers to Homework and Assignment Questions, Writing Essays, Scan &amp; Solve Math Problems, Summarize or ask AI Chat Smith anything with Chat PDF<br>- Write Music, Translations, Grammar check &amp; correction<br>- Start conversations to get more creative with your unique ideas and examples.<br> <br>AI Chatbot Chat Smith has a user-friendly interface and intuitive design that you&#39;ll be able to start asking our AI Chat Smith Smart Assistant built on advanced in no time.<br><br>Whether you need help with a specific problem, want to learn more about a certain topic, or just want to have a conversation, open this app, our AI Chat Smith Smart Assistant has you covered.<br><br>Privacy Policy: https://smartwidgetlabs.com/privacy-policy/<br>Terms of use: https://smartwidgetlabs.com/terms-of-use/<br>You are welcome to contact us at support@smartwidgetlabs.com",Smart Widget Labs Co Ltd,https://play-lh.googleusercontent.com/_wcc1yeDtK4dvgwOLt-VkMSMXDRZbcpWDNLXn9jTu8g6CjByl9X74_JZsQo8ukp_Bsw,Productivity,,,0,USD,"10,000,000+",AI Chat Smith Smart Assistant
com.aisuccess.ai_game_master,True,4.556604,"https://play-lh.googleusercontent.com/4cHhoan8XMmX87ebAzIzEjxoFA-MRZbmN5lGrE0Yh5LbSQazpAn2MjEeMrihSXeyMQk, https://play-lh.googleusercontent.com/hP9O02IxzaTHmNpV7MJTa6LjD85lznXivhcC7zzJrAMHn_whhS7-F9PDLPIDsAFlxR6I, https://play-lh.googleusercontent.com/0TvpDeWXD0uKR13QSxikZszGPBrrqYsBryAhZc9alTr4caJDQx3MeP0gNPFqSViyQ9mC, https://play-lh.googleusercontent.com/AbZexYvelQU0yrRFTRnC8qatBoc2CXTHFJ1iDbS4YKY2LvFr6x5Xck5j4M_NKgpyJxY, https://play-lh.googleusercontent.com/YIgM3HWcscT0bK1VxaLHctUcjzd8cg5ZdXe1TpczJAAdtaPqUQaAC4GjB30-H1KSu_s, https://play-lh.googleusercontent.com/UjNLx944X135R6Jgusx6TONbc3NqOFNQ3CNKDw_4dk8Ji2mTudvo5LpIH4zaDK8MCRg, https://play-lh.googleusercontent.com/xQq59r-z6h6KmtWC1vn1opxWgGIXxXNG2DDZp_e6wFzJvwA76dnqeCNW70ETpwLRKA, https://play-lh.googleusercontent.com/lTO7eUBLRjp1TdIPY3auD8AmQuzvcq7NwRvLroTEy5XMddMDBUaFdcMPSw2hT20AVw, https://play-lh.googleusercontent.com/YRx5OZsJ_PwLHr6Cq5pwG_faStTA74swhTZIfCZI5fbFUnn4gyGs7bs3jqUyMRCtJaCa, https://play-lh.googleusercontent.com/O-IWvGNkN49VSGgm36NwpO1qGoS91c8IyBB_WD1Y6yhtyJia-qYW8neiwcv1atY4zg, https://play-lh.googleusercontent.com/yQeCgfpl93kAxJCOP5QElQaAa3_-B_4-wll5D9wfF7--hsMCGVsPuzqjAxF_UdSX2NM, https://play-lh.googleusercontent.com/2VMV9D9TPTU6x_Ka4RmXQwEOhWTKLZ4BCruhiy3lsb9JfHYbalRvS1L85y_lZb3kew, https://play-lh.googleusercontent.com/nWn4K5yyDE-2lExvbgFZF6Pes1ouVYfn6TAfkT9Q5n10INmFrWanYZio79TratZKZu4, https://play-lh.googleusercontent.com/l85ucI1pbAdhJBEAU0fX-0lm88bf5tYGG18Qi2rBOON6ywcapqcJOKeGm42JHcy8eOG-, https://play-lh.googleusercontent.com/Ud0sscm0d-U0PrGRfffIhZG1JoFxr_5wtxZadVfrMd3_1gInop_KjPa3oybwl18JtQ, https://play-lh.googleusercontent.com/41NHd2_OHJh0mxXcMCiD7JdzO4HjJhVhAbJTWOTehOAE1Urckm_0QgVzaP_Jsjaa3QA, https://play-lh.googleusercontent.com/vAwuBkYRtsyI4gP9MZFVP_NpEa2V_KdxdQxYhpMmto-GYuQex05P1VJCQ1N467QQlcmy, https://play-lh.googleusercontent.com/SHTArdt3vIzTBiR-AeJOpsk53a_FUEJXIeVhlH9TcpwLcSyB3reudGUddd4iwzhIHtQ, https://play-lh.googleusercontent.com/cdXkY9TDld4_akMWqWj3qaNCSZQAwFtXYW_zZP1stYhJOsOL2SkO3qELh2tp1-OWvmE, https://play-lh.googleusercontent.com/Aaa0sSH-QCTzXb1DVmgavZYHTXGAy0fQGUfReAUq2XPscgEw1FrBJagQjx6lo8ViKgMC, https://play-lh.googleusercontent.com/ckhLF1IHX9chh4sPyns9GhFAYM7T7An6VsSLcSbRQYWJiKsPT9PAW4uB8J43tI2sDA, https://play-lh.googleusercontent.com/XDeaJL7eGR_pDgbGARNaB7FjD7-tKKFE-WGX69M4TJBFE0_57CdP9Xd5nh17_hX8yVk, https://play-lh.googleusercontent.com/latsNHdiwyE19tnbn6ljEdB7oB6injjJ_WFkvugqMBy80Tm1X4rjlvvmRMikMGMp0fc, https://play-lh.googleusercontent.com/uP0edIa9pcqowG7L3D2ALo8dIht27yYvt__WaDS03uL59lrebr39tYu4ulMSOG69wtXj, https://play-lh.googleusercontent.com/_efSuxdXzkow5d6cuoYKDAHAcCuKLWJ_YAiBIS5SlH3bXIRxnk4nDOGIW-gzBe8hvs0q, https://play-lh.googleusercontent.com/OlGh8rToQhKg5bUVOqLV94rK_9tYD3dv6K3PDBGlIv9PfQqbDgmCgRo1wE4nj26Ej7_q, https://play-lh.googleusercontent.com/cdXc3EhdrCspDH6-wke01mh_UJr6pqrlIXO7UNvifDKA0zlBewMXdIwG-ZKDKWwZEQ, https://play-lh.googleusercontent.com/3CViurjL9qDZP_KXZpydx7TBwkbhtNl9Y4Qs4TSh5cKL0slVZmhZjxjnohu-MAE7Dd8, https://play-lh.googleusercontent.com/j2OhDgF-BWc_ELJep8iaGO8O4vSsubwTcY4kx5J5GzvYr4EDBM6oVYBR2qDebOuVNIY, https://play-lh.googleusercontent.com/td0W17rd9g-sqpiReJacmY6pwVnW-xKuTPdAXt8hdLkk84haYQ6z4OvQZYzbYtoSu48, https://play-lh.googleusercontent.com/uErBDph9FeticP7sQJa3tA_jxOb_Mjp6Vf8g3vMoaaHheT6k0XijoR2_PChhG3Tvu1jJ","AI Game Master: A New Era in GPT-Powered AI Fantasy Text RPG Adventures<br><br>Enter the world of a groundbreaking AI game marking a new era in GPT-powered AI fantasy text adventures. This roleplay app, leveraging advanced artificial intelligence, serves as an oasis for text RPG enthusiasts and AI chat aficionados. It offers a boundless landscape for AI-driven gaming and traditional dungeon roleplay, seamlessly blending to foster endless AI interactive stories and AI chat roleplay opportunities.<br><br>Central to Ai Game Master is its innovative GPT-based Game Master, a marvel in the realm of AI text RPG games. It introduces a unique free text combat system, distinguishing itself among text RPGs and dungeon adventures. Players can engage in conversation with a sophisticated AI chat bot, guiding the narrative with unparalleled freedom in their text adventure. This AI chat roleplay feature represents a paradigm shift in text RPGs, offering players the chance to mold their AI story in ways traditional games cannot match.<br><br>Ai Game Master is not just an AI-driven text RPG adventure; it&#39;s a gateway to interactive dungeon stories where players choose their own path. Beyond its single-player AI game capabilities, it features a local multiplayer mode, perfect for collaborative roleplay. Each session becomes a shared AI story, making every encounter a dynamic and memorable AI-driven text RPG experience.<br><br>To enhance the visual appeal of your text adventures, we integrate high-quality, AI-generated imagery for each AI story. These visuals transform text-based scenarios into vivid, immersive realities. The AI story generator, equipped with GPT and AI chat technology, excels at creating visuals that complement the essence of AI fantasy text RPGs, ensuring a rich, engaging dungeon roleplay session.<br><br>Key Features:<br>- No Limits: Dive into a world of endless possibilities for creativity and exploration in text RPG adventures.<br>- Unique Free Text Combat System: Experience battles and scenarios with unparalleled freedom, bringing your narrative choices to life.<br>- Infinite Adventures: Discover a new journey every time, with a multitude of dungeon stories to explore and conquer.<br>- Local Multiplayer: Enjoy collaborative and thrilling adventures with friends, enhancing the excitement of roleplay.<br>- High-Quality Images: Each adventure is visually enriched with stunning graphics, elevating the immersion in your gaming experience.<br><br>Embark on your journey with Ai Game Master today – where every text adventure is as limitless as your imagination and as fun as you can make it. Ready to play?",Digital Dynasty Entertainment,https://play-lh.googleusercontent.com/4EbdikNafC4L0oPYTMwhF9-fI17IoleC_TpjDoH8v4ptvQlicS4vPse2jE2R5xTd7GU,Role Playing,https://i.ytimg.com/vi/QRVollR3yw8/hqdefault.jpg,https://www.youtube.com/embed/QRVollR3yw8?ps=play&vq=large&rel=0&autohide=1&showinfo=0,0,USD,"50,000+",AI Game Master - Dungeon RPG
